label_str,ltable_id,rtable_id,label,id_x,title_x,authors_x,venue_x,year_x,id_y,title_y,authors_y,venue_y,year_y
Yes,2333,2007,1,2333,"multi-dimensional clustering : a new data layout scheme in db2 bishwaranjan bhattacharjee , sriram padmanabhan , matthew huras , leslie cranston , timothy malkemus 2003",,sigmod conference,,2007,multi-dimensional clustering : a new data layout scheme in db2 international conference on management of data,"sriram padmanabhan , bishwaranjan bhattacharjee , tim malkemus , leslie cranston , matthew huras",,2003.0
Yes,799,53,1,799,dynamat : a dynamic view management system for data warehouses 1999,"nick roussopoulos , yannis kotidis",sigmod conference,,53,"dynamat : a dynamic view management system for data warehouses yannis kotidis , nick roussopoulos international conference on management of data 1999",,,
Yes,2583,598,1,2583,book review column 2001,karl aberer,sigmod record,,598,book review column acm sigmod record 2001,karl aberer,,
Yes,1795,1024,1,1795,querying a multilevel database : a logical analysis,frédéric cuppens,vldb,1996.0,1024,querying a multilevel database : a logical analysis,fr &#233; d &#233; ric cuppens,very large data bases,1996.0
Yes,977,544,1,977,the ecobase project : database and web technologies for environmental information systems 2001,"asterio k. tanaka , patrick valduriez",sigmod record,,544,the ecobase project : database and web technologies for environmental information systems acm sigmod record,"luc bouganim , maria claudia cavalcanti , fran &#231; oise fabret , maria luiza campos , fran &#231; ois llirbat , marta mattoso , rubens melo , ana maria moura , esther pacitti , fabio porto , margareth simoes , eric simon , asterio tanaka , patrick valduriez",,2001.0
Yes,1529,1656,1,1529,multigranularity locking in multiple job classes transaction processing system,"sheung-lun hung , shan-hoi ng",sigmod record,1995.0,1656,multigranularity locking in multiple job classes transaction processing system acm sigmod record,"shan-hoi ng , sheung-lun hung",,1995.0
Yes,1447,2205,1,1447,qualified answers that reflect user needs and preferences vldb 1994,"terry gaasterland , jorge lobo",,,2205,qualified answers that reflect user needs and preferences very large data bases 1994,"terry gaasterland , jorge lobo",,
Yes,2610,1689,1,2610,database research at nthu and itri arbee l. p. chen 1994,,sigmod record,,1689,database research at nthu and itri arbee l. p. chen 1994,,acm sigmod record,
Yes,107,799,1,107,hierarchical prefix cubes for range-sum queries vldb 1999,"chee yong chan , yannis e. ioannidis",,,799,hierarchical prefix cubes for range-sum queries,"chee yong chan , yannis e. ioannidis",very large data bases,1999.0
Yes,2102,967,1,2102,querying continuous time sequences,"tore risch , ling lin",vldb,1998.0,967,"querying continuous time sequences ling lin , tore risch very large data bases 1998",,,
Yes,466,510,1,466,a cost model for query processing in high dimensional data spaces,christian böhm,acm trans . database syst .,2000.0,510,a cost model for query processing in high dimensional data spaces christian b &#246; hm acm transactions on database systems ( tods ),,,2000.0
Yes,1452,2125,1,1452,book review column,karl aberer,sigmod record,2003.0,2125,book review column karl aberer acm sigmod record,,,2003.0
Yes,1017,1977,1,1017,safe and efficient sharing of persistent objects in thor 1996,"atul adya , liuba shrira , miguel castro , robert gruber , andrew c. myers , barbara liskov , umesh maheshwari , sanjay ghemawat , mark day",sigmod conference,,1977,safe and efficient sharing of persistent objects in thor,"b. liskov , a. adya , m. castro , s. ghemawat , r. gruber , u. maheshwari , a. c. myers , m. day , l. shrira",international conference on management of data,1996.0
Yes,1231,330,1,1231,i/o reference behavior of production database workloads and the tpc benchmarks - an analysis at the logical level,"windsor w. hsu , alan jay smith , honesty c. young",acm trans . database syst .,2001.0,330,i/o reference behavior of production database workloads and the tpc benchmarks-an analysis at the logical level acm transactions on database systems ( tods ),"windsor w. hsu , alan jay smith , honesty c. young",,2001.0
Yes,2474,1924,1,2474,"on the semantics of `` now '' in databases christian s. jensen , tomás isakowitz , richard t. snodgrass , curtis e. dyreson , james clifford 1997",,acm trans . database syst .,,1924,on the semantics of now in databases acm transactions on database systems ( tods ),"james clifford , curtis dyreson , tom &#225; s isakowitz , christian s. jensen , richard thomas snodgrass",,1997.0
Yes,34,1147,1,34,efficient snapshot differential algorithms for data warehousing,"hector garcia-molina , wilburt labio",vldb,1996.0,1147,efficient snapshot differential algorithms for data warehousing,"wilburt labio , hector garcia-molina",very large data bases,1996.0
Yes,2586,2166,1,2586,italian electronic identity card - principle and architecture mario gentili 2001,,vldb,,2166,italian electronic identity card - principle and architecture,mario gentili,very large data bases,2001.0
Yes,578,2248,1,578,"are quorums an alternative for data replication ? bettina kemme , ricardo jiménez-peris , marta patiño-martínez , gustavo alonso acm trans . database syst .",,,2003.0,2248,are quorums an alternative for data replication ? acm transactions on database systems ( tods ),"ricardo jim &#233; nez-peris , m. pati &#241; o-mart &#237; nez , gustavo alonso , bettina kemme",,2003.0
Yes,1537,492,1,1537,an optimisation scheme for coalesce/valid time selection operator sequences costas vassilakis sigmod record 2000,,,,492,an optimisation scheme for coalesce/valid time selection operator sequences acm sigmod record 2000,costas vassilakis,,
Yes,616,1348,1,616,"mv3r-tree : a spatio-temporal access method for timestamp and interval queries dimitris papadias , yufei tao vldb 2001",,,,1348,"mv3r-tree : a spatio-temporal access method for timestamp and interval queries yufei tao , dimitris papadias very large data bases 2001",,,
Yes,1121,473,1,1121,re-designing distance functions and distance-based applications for high dimensional data charu c. aggarwal,,sigmod record,2001.0,473,re-designing distance functions and distance-based applications for high dimensional data,charu c. aggarwal,acm sigmod record,2001.0
Yes,2143,1073,1,2143,data warehouse configuration vldb,"timos k. sellis , dimitri theodoratos",,1997.0,1073,data warehouse configuration very large data bases 1997,"dimitri theodoratos , timos k. sellis",,
Yes,1497,1118,1,1497,flexible relations - operational support of variant relational structures vldb,"peter dadam , christian kalus",,1995.0,1118,flexible relations - operational support of variant relational structures very large data bases 1995,"christian kalus , peter dadam",,
Yes,913,1004,1,913,"checkpointing in oracle juan loaiza , ashok joshi , tirthankar lahiri , william bridge vldb 1998",,,,1004,"checkpointing in oracle ashok joshi , william bridge , juan loaiza , tirthankar lahiri very large data bases 1998",,,
Yes,1168,1990,1,1168,cost-based optimization for magic : algebra and implementation sigmod conference 1996,"hamid pirahesh , t. y. cliff leung , s. sudarshan , praveen seshadri , divesh srivastava , raghu ramakrishnan , joseph m. hellerstein , peter j. stuckey",,,1990,"cost-based optimization for magic : algebra and implementation praveen seshadri , joseph m. hellerstein , hamid pirahesh , t. y. cliff leung , raghu ramakrishnan , divesh srivastava , peter j. stuckey , s. sudarshan",,international conference on management of data,1996.0
Yes,372,93,1,372,database research at the university of oklahoma sigmod record 1999,"sirirut vanichayobon , leonard brown , ravi a. dirckze , sylvain guinepain , carlos sánchez , le gruenwald , brian summers",,,93,database research at the university of oklahoma acm sigmod record,"le gruenwald , leonard brown , ravi dirckze , sylvain guinepain , carlos sanchez , brian summers , sirirut vanichayobon",,1999.0
