label_str,ltable_id,rtable_id,label,id_x,title_x,category_x,brand_x,modelno_x,price_x,id_y,title_y,category_y,brand_y,modelno_y,price_y
Yes,1359,1903,1,1359,sony bcvw1 ac charger for w series battery,photography - general,sony,bcvw1,44.88,1903,sony bcvw1 quick charger for w series batteries black,battery chargers,sony,bcvw1,44.88
Yes,1899,5458,1,1899,panasonic kx-fatc506 high yield cyan toner cartridge,printers,panasonic,kx-fatc506,89.84,5458,cyan toner cartridge for kx-mc6020 6040 high yield,printer ink toner,panasonic,kx-fatc506,81.57
Yes,261,5192,1,261,xerox 108r00645 imaging unit for phaser 6300 and 6350 printer,printers,xerox,108r00645,244.84,5192,xerox printers imaging unit phaser 6300 6350 108 r00645,printer ink toner,xerox,108r00645,253.79
Yes,131,5595,1,131,sabrent usb 2.0 wireless 802.11 g adapter,networking,sabrent,nt-wghu,24.88,5595,sabrent nt-wghu high-power 1000mw wireless usb 802.11 g adapter for wardriving range extension with 7 folding booster 6dbi,computers accessories,sabrent,nt-wghu,24.88
Yes,1037,12168,1,1037,planar 997-2797-00 pl series pl1910m lcd monitor,monitors,planar,997-2797-00,179.0,12168,planar pl1910m-bk 19-inch digital analog lcd monitor with speakers black,monitors,planar,997-2797-00,179.0
Yes,376,9389,1,376,toshiba ph3100u-1e3s 1tb usb 3.0 desktop hard drive,hard drives,toshiba,ph3100u-1e3s,89.0,9389,toshiba 1 tb usb 3.0 external hard drive ph3100u-1e3s black silver,external hard drives,toshiba,ph3100u-1e3s,80.23
Yes,1081,21587,1,1081,garmin gpsmap 78s 010-00864-01 marine gps navigator and world wide chartplotter,handheld gps,garmin,gpsmap 78s,399.88,21587,garmin gpsmap 78s 010-00864-01 marine gps navigator and world wide chartplotter,boating gps units chartplotters,garmin,010-00864-01,399.88
Yes,669,12490,1,669,creative labs sound blaster tactic3d alpha,electronics - general,creative labs,gh012000003,59.99,12490,creative labs 70gh012000003 sound blaster tactic 3d alpha usb gaming headset,accessories supplies,creative labs,70gh012000003,49.93
Yes,2405,8668,1,2405,hp laserjet 53x black print cartridge,printers,hp,q7553x,164.84,8668,hp laserjet 53x black print cartridge in retail packaging,printer ink toner,hp,q7553x,134.99
Yes,2474,14437,1,2474,cooler master hyper 212 plus universal cooler,electronics - general,coolermaster,rr-b10-212p-g1,29.99,14437,cooler master hyper 212 plus 120mm sleeve cpu cooler rr-b10-212p-g1,computers accessories,cooler master,rr-b10-212p-g1,27.66
Yes,1256,20411,1,1256,netgear wireless-n 150 access point wn604,networking,netgear,wn604-100nas,55.88,20411,wireless-n 150 access point,networking products,netgear,wn604-100nas,63.99
Yes,2276,12760,1,2276,lorex lne1001 easy connect network ip camera,computers,lorex,,121.84,12760,lorex lne1001 easy connect network ip remote surveillance camera white,surveillance cameras,lorex,lne1001,126.02
Yes,2245,3566,1,2245,scosche 1995-97 general motors sonoma chevrolet s10 rack kit color match,car stereos,scosche,gm1515b,9.88,3566,scosche gm1515b s10 rack kit for 1995-97 general motors sonoma chevrolet,power-cable terminals,scosche,gm1515b,9.88
Yes,15,4282,1,15,avery self-adhesive filing labels 1 3 cut 3-7 16 x 2 3 clear 450 pack,stationery & office machinery,avery,5029,21.47,4282,avery 5029 clear self-adhesive filing labels 3-7 16 x 2 3 30 sheet 450 pack,file folder labels,avery,5029,14.2
Yes,898,7383,1,898,tp-link tl-sc3171g wireless day night surveillance camera,garden - general,tp link,tl-sc3171g,172.0,7383,tl-sc3171g surveillance network camera - color,networking products,tp-link,tl-sc3171g,139.99
Yes,1183,11288,1,1183,vantec 2-port superspeed usb 3.0 expresscard 34,electronics - general,vantec,ugt-uc302cb,40.33,11288,vantec 2-port superspeed usb 3.0 expresscard 34,usb flash drives,vantec,ugt-uc302cb,37.99
Yes,1504,4817,1,1504,kensington wireless presenter pro with green laser pointer,stationery & office machinery,kensington,k72353us,59.88,4817,kensington k72353us wireless presenter pro with green laser pointer,laser pointers,kensington,k72353us,59.88
Yes,2039,7443,1,2039,startech.com pm1115u fast ethernet print server,networking,startech,pm1115u,40.84,7443,startech.com 10 100 mbps usb print server pm1115u,print servers,startech,pm1115u,35.23
Yes,1437,11704,1,1437,plantronics usb-to-headset adapter,electronics - general,plantronics,da-40,27.98,11704,plantronics headset to usb adapter da40,accessories supplies,plantronics,da40,27.98
Yes,561,18152,1,561,da-lite da-plex self trimming rear projection screen - 96 x 120 av format,electronics - general,da-lite,27903,7799.99,18152,da-lite 27903 da-plex self trimming rear projection screen - 96 x 120 av format,projection screens,da-lite,,
Yes,2374,3051,1,2374,hp 920 cyan officejet ink cartridge ch634an,printers,hp,hp ch634an # 140,13.97,3051,hp 920 cyan ink cartridge in retail packaging ch634an 140,printer ink toner,hp,ch634an # 140,
Yes,687,20212,1,687,startech.com pex1p 1 port pcie dp parallel adapter card,electronics - general,startech,pex1p,32.88,20212,startech.com 1-port pci express dual profile parallel adapter card - spp epp ecp pex1p,memory card adapters,startech,pex1p,26.99
Yes,1512,20844,1,1512,uniden d1680 dect 6.0 with caller id and call waiting,electronics - general,uniden,d1680,33.84,20844,new-uniden d1680 dect 6.0 cordless phone system with answering system call waiting caller id single-handset system - unnd1680,cordless telephones,uniden,,37.87
Yes,2461,13243,1,2461,filemate imagine series k2010 usb standard keyboard,computers,,,15.12,13243,wintec filemate imagine series k2010 usb standard keyboard - jet black 3fmnk2010ubk-r,keyboards,wintec,3fmnk2010ubk-r,15.99
Yes,2149,4784,1,2149,kodak easyshare m552 dark pink 14mp digital camera w 5x optical zoom 2.7 lcd display w 50 bonus prints,digital cameras,kodak,m552pink,94.54,4784,kodak easyshare m552 14 mp digital camera with 5x optical zoom and 2.7-inch lcd - dark pink new model,point shoot digital cameras,kodak,1942390,
Yes,313,8870,1,313,sabrent 2-port vga high resolution video splitter,electronics - general,sabrent,vd-vs2p,24.88,8870,kinamax vd-vs2p kinamax 2 port vga video splitter with up to 2048x1536 high resolution and 350mhz,computers accessories,kinamax,vd-vs2p,24.99
Yes,1195,5364,1,1195,targus 17 platinum blacktop standard laptop computer case black gray,electronics - general,targus,cpt301us,46.88,5364,targus platinum blacktop 17 standard laptop case - notebook carrying case - 17 - gray black,bags cases,targus,cpt301us,35.17
Yes,1813,1607,1,1813,xantech 283tpd designer twin plug blink emitter,stereos/audio,xantech,283tpd,14.88,1607,xantech 283tpd designer twin plug blink emitter,accessories supplies,xantech,283tpd,13.64
Yes,2165,21076,1,2165,targus rg0315c pulse backpack notebook case,computers,targus,,38.88,21076,targus rg0315c pulse backpack for notebooks up to 15.4-inch screens black,bags cases,targus,rg0315c,32.82
Yes,1209,9717,1,1209,polaroid i1237 pink 12mp digital camera w 3x optical zoom 2.7 lcd display,digital cameras,polaroid,cia-1237pc,68.0,9717,polaroid cia-1237pc 12 mp digital camera with 3x optical zoom pink,point shoot digital cameras,polaroid,cia-1237pc,69.99
Yes,1362,17388,1,1362,cardinal zippered binder pockets 8-1 2 x 11 clear 3 pack,stationery & office machinery,,,5.27,17388,cardinal 14201 - zippered binder pockets 8-1 2 x 11 clear 3 pockets pack,storage presentation materials,cardinal,,
Yes,2083,14539,1,2083,cables unlimited sata ii 3gbps to esata cable with straight connectors,electronics - general,cables unlimited,flt-6600-39,9.82,14539,cables unlimted flt-6600-39 39-inch sata ii 3 gbps to esata cable with straight connectors,cables interconnects,cables unlimited,flt-6600-39,3.24
Yes,128,10640,1,128,motorola tz700 bluetooth roadster visor speaker,electronics - general,motorola,89423n,54.54,10640,motorola roadster bluetooth in-car speakerphone retail packaging,car kits,motorola,89423n,53.52
Yes,759,8381,1,759,apricorn 320gb padlock 128-bit hardware-encrypted portable drive,hard drives,apricorn,a25-pl128-320,99.82,8381,apricorn aegis padlock 320 gb usb 2.0 128-bit encrypted portable external hard drive a25-pl128-320 grey,usb flash drives,apricorn,a25-pl128-320,99.0
Yes,1141,9253,1,1141,western digital elements 500gb portable se portable hard drive black,hard drives,western digital,wdbabv5000abk-nesn,71.98,9253,western digital wd elements se portable 500 gb usb 2.0 external hard drive,external hard drives,western digital,wdbabv5000abk-nesn,59.99
Yes,1153,9237,1,1153,filemate imagine series m2810 usb standard mouse,computers,,,8.98,9237,wintec filemate imagine series m2810 usb standard mouse - white with jet black 3fmnm2810ubk-r,mice,wintec,3fmnm2810ubk-r,11.99
Yes,356,21591,1,356,epson t008201 color ink cartridge for stylus color 780 870 875 dc 875dcs and 890,printers,epson,t008201,20.84,21591,epson t008201 color inkjet cartridge,inkjet printer ink,epson,t008201,18.18
Yes,1862,15434,1,1862,sony zx series stereo headphones white,electronics - general,sony,mdrzx100/whi,24.88,15434,sony mdrzx100 whi outdoor headphones,headphones,sony,mdrzx100/whi,15.49
Yes,95,10966,1,95,hp ce505xd black laserjet print cartridges 2pk,printers,hp,hp ce505xd,258.84,10966,hp laserjet 05x black dual pack cartridge in retail packaging ce505xd,laser printer toner,hp,ce505xd,235.11
Yes,920,3246,1,920,xantech sllc1 speaker level to line converter,stereos/audio,xantech,sllc1,40.88,3246,xantech sllc1 speaker level to line converter,audio video accessories,xantech,sllc1,28.42
Yes,893,11620,1,893,samsung 470 series 128gb sata ii solid state drive,hard drives,samsung,mz-5pa128 / us,199.0,11620,samsung 128gb solid state drive mz-5pa128,computer components,samsung,mz-5pa128 / us,194.99
Yes,2365,8618,1,2365,canon cli-226 black ink tank,printers,canon,4546b001,13.97,8618,canon cli-226 black ink tank 4546b001 in retail packaging,inkjet printer ink,canon,4546b001,13.97
Yes,218,5046,1,218,griffin technology outfit gloss ipod touch 4g black,mp3 accessories,griffin technology,gb01967,24.99,5046,griffin gb01967 outfit gloss for ipod touch 4g black,cases,griffin technology,gb01967,3.97
Yes,1953,11438,1,1953,startech 3-port 2b 1a 1394 mini pci express firewire card adapter,electronics - general,startech,mpex1394b3,69.0,11438,startech.com 3 port 2b 1a 1394 mini pci express firewire card adapter mpex1394b3,firewire port cards,startech,mpex1394b3,61.24
Yes,1423,9727,1,1423,pny 4gb mini flash drive,usb drives,pny,p-fd4gb / mini-efm1,12.88,9727,pny mini attach 4gb usb 2.0 flash drive p-fd4gb mini-ef,usb flash drives,pny,p-fd4gb / mini-ef,12.05
Yes,916,8910,1,916,iogear smartlink usb 2.0 adapter,networking,iogear,gun262wv,16.23,8910,iogear smartlink usb 2.0 adapter gun262wv black,connectors adapters,iogear,gun262wv,18.18
Yes,522,14014,1,522,veho vcca002wpc waterproof case for muvi muviturin,camera and camcorder accessories,veho,vcca002wpc,29.98,14014,veho vcca002wpc waterproof case for muvi micro camcorder,cases bags,veho,vcca002wpc,27.05
Yes,1217,5249,1,1217,verbatim smartdisk acclaim 320gb usb portable hard drive blue,hard drives,verbatim,ver97185,59.84,5249,verbatim acclaim 320 gb usb 2.0 portable external hard drive 97185 blue,,verbatim,97185,59.84
Yes,128,2701,1,128,motorola tz700 bluetooth roadster visor speaker,electronics - general,motorola,89423n,54.54,2701,motorola tz700 roadster visor speakerphone,faceplates,motorola,89423n,53.49
Yes,2511,21503,1,2511,lg 42 class lcd 1080p 60hz hdtv 42lk450,electronics : flat panel tv,lg,42lk450,579.0,21503,lg 42lk450 42-inch 1080p 60 hz lcd hdtv,tvs,lg,42lk450,
Yes,276,15426,1,276,sony vgp-bkb1 bluetooth wireless keyboard,electronics - general,sony,vgpbkb1,97.15,15426,sony vaio bluetooth keyboard,keyboards,sony,vgp-bkb1,97.68
Yes,597,22043,1,597,avery matte white cd dvd labels for inkjet printers 40 face labels 80 spine labels,printers,avery personal creations,8692,16.47,22043,avery cd dvd labels matte white 40 disc labels and 80 spine labels 8692,labels stickers,avery,8692,14.12
Yes,547,9295,1,547,verbatim 96438 2gb store n go usb 2.0 flash drive,usb drives,verbatim,96438,14.84,9295,verbatim store n go 2 gb usb 2.0 flash drive 96438 metallic pink,usb flash drives,verbatim,96438,9.99
Yes,719,6972,1,719,hp q6511a hp 11a toner 6000 page-yield black,printers,hp,q6511a,191.03,6972,hp q6511a laserjet 11a black print cartridge in retail packaging,laser printer toner,hp,q6511a,
Yes,29,6031,1,29,vantec nexstar mx dual 3.5 sata hard drive enclosure,electronics - general,vantec,nst-400mx-s2,49.71,6031,vantec nexstar mx nst-400mx-s2 dual 3.5-inch sata to usb 2.0 with jbod external hard drive enclosure black,hard drive enclosures,vantec,nst-400mx-s2,44.99
Yes,2164,3694,1,2164,belkin f1dd104l soho 4-port dvi usb kvm switch,networking,belkin,f1dd104l,188.84,3694,4 port dvi-usb kvm switch with four usb dvi cables,kvm switches,belkin,f1dd104l,163.99
Yes,54,6572,1,54,canon imageformula dr-2010c compact color scanner,electronics - general,canon,dr-2010c,479.98,6572,canon 2454b002 imageformula dr-2010c compact color scanner,scanners,canon,2454b002,400.0
Yes,652,7445,1,652,startech 6 rj-45 to db9 cisco console management router cable,electronics - general,startech,db9concabl6,19.0,7445,startech.com cisco console management router cable - serial cable - rj-45 m - db-9 f - 6 ft - blue 6ft rj45 to db9 cisco cons rtr cbl manufacturer part number db9concabl6,printer ink toner,startech.com usa llp,,25.0
Yes,2037,21543,1,2037,corsair xms2 4 gb 2 x 2 gb pc2-6400 800 mhz 240-pin ddr2 dual-channel memory kit - twin2x4096-6400c5,memory,corsair,twin2x4096-6400c5,74.82,21543,corsair xms2 4 gb 2 x 2 gb pc2-6400 800 mhz 240-pin ddr2 dual-channel memory kit - twin2x4096-6400c5,computer components,corsair,twin2x4096-6400c5,39.99
Yes,2156,14545,1,2156,cables unlimited - 1 port db25 parallel pci ecp epp spp port i o card,electronics - general,cables unlimited,ioc-1000,16.88,14545,cables unlimited tm 1 - port db25 parallel pci i o card ioc1000,computers accessories,cables unlimited,ioc1000,20.29
Yes,351,10048,1,351,acer iconia tab with wi-fi 10.1 touchscreen tablet pc featuring android 3.0 honeycomb operating system aluminum metallic - 32gb,laptop computers,acer,a500-10s32u,498.0,10048,acer iconia tab a500-10s32u 10.1-inch tablet aluminum metallic,tablets,acer,a500-10s32u,449.0
Yes,7,1303,1,7,visioneer rw120-wu roadwarrior sheetfed scanner,electronics - general,visioneer,rw120-wu,199.98,1303,visioneer roadwarrior mobile 600 dpi usb scanner rw120-wu,scanners,visioneer,rw120-wu,
Yes,1349,12191,1,1349,night owl security products ccd wired color security camera with 60 cable,garden - general,night owl,cam-s420-245a,67.82,12191,night owl security products cam-s420-245a ccd wired color security camera with 60 of cable,bullet cameras,night owl optics,cam-s420-245a,59.99
Yes,1298,8455,1,1298,lenovo thinkpad x60 tablet digitizer pen tether 3pk,electronics - general,lenovo,41u4820,13.67,8455,lenovo thinkpad x60 tablet tether,computer accessories,lenovo,41u4820,10.33
Yes,769,6362,1,769,accell proultra 4m hdmi ethernet cable,tv accessories,accell,b116c-013b-40,29.88,6362,accell proultra supreme b116c-013b-40 high speed hdmi cable with ethernet 4m,hdmi cables,accell,b116c-013b-40,21.68
Yes,2539,10705,1,2539,ghent triumph display easel gray,stationery & office machinery,ghent,19250,26.09,10705,new-ghent 19250 - triumph display easel adjust 36 to 62 high gray - ghe19250,stands,ghent,,65.0
Yes,625,18443,1,625,da-lite da-glas standard rear projection screen 72 x 96 video format,electronics - general,da-lite,27639,4448.99,18443,da-lite 27639 da-glas standard rear projection screen 72 x 96 video format,projection screens,da-lite,,
Yes,1997,12451,1,1997,d-link dgs-1005g 5-port gigabit desktop switch,networking,d-link,dgs1005g,27.88,12451,d-link dgs-1005g 5-port gigabit desktop switch,switches,d-link,dgs-1005g,27.88
Yes,803,4121,1,803,scosche ka2064b 2005 kia sportage iso kit,car stereos,scosche,ka2064b,15.88,4121,scosche ka2064b dash kit for 2005 and up kia sportage,dash mounting kits,scosche,ka2064b,10.99
Yes,2194,5101,1,2194,fellowes hd precision cordless mouse,mice,fellowes,98904,44.84,5101,fellowes hi def mouse cordless-5btn silver blue usb 98904,mice,fellowes,98904,44.84
Yes,725,16800,1,725,c-line top-load poly sheet protectors heavy gauge letter 200ct,stationery & office machinery,,62097,28.94,16800,c-line 62097 - top-load polypropylene sheet protectors heavy gauge letter 200 box,storage presentation materials,c-line,,
Yes,1713,21093,1,1713,quality park classic style invitation envelope contemporary white,stationery & office machinery,,36226,52.94,21093,quality park 36226 - classic style invitation envelope contemporary 5 1 2 white 500 box,binding machine supplies,quality park,,
Yes,2078,3894,1,2078,dymo d1 standard tape cartridge for dymo label makers 1 4in x 23ft black on clear,stationery & office machinery,dymo,43610,17.27,3894,dymo d-1 tape 0.25 inches x 23 feet black on clear 1 card 43610,labeling tapes,dymo,43610,
Yes,136,2576,1,136,casio xj-a235u green slim dlp projector,electronics - general,casio,xja235u,1199.99,2576,casio green slim line projector xj-a235u,video projectors,casio,xj-a235u,
Yes,205,10517,1,205,cleaning cards for canon cr-series check scanners,electronics - general,canon,1904v566,29.88,10517,cleaning cards for canon cr-series check scanners box of 15,scanners,canon,1904v566,21.95
Yes,2190,21661,1,2190,benq ms612st 3d-ready projector,electronics - general,benq,ms612st,699.0,21661,benq projector ms612st,video projectors,benq,9h . j4177 .14 e,
Yes,370,15071,1,370,eye-fi connect x2 4gb wireless sd memory card,usb drives,eye-fi,eyefi4cn,39.88,15071,eye-fi connect x2 4 gb class 6 sdhc wireless flash memory card eye-fi-4cn,blank media,eye-fi,eye-fi-4cn,39.88
Yes,215,6601,1,215,buffalo technology ministation metro 1 tb usb 2.0 portable external hard drive with integrated flex cable encryption and turbopc hd-pxt1tu2 b black,hard drives,buffalo technology,hdpxt1tu2b,99.82,6601,buffalo technology ministation metro 1 tb usb 2.0 portable external hard drive with integrated flex cable encryption and turbopc hd-pxt1tu2 b black,computers accessories,buffalo technology,hd-pxt1tu2 / b,99.82
Yes,387,3169,1,387,evga 1gb geforce gt 520 ddr3 graphics card,electronics - general,evga,01gp31521kr,68.99,3169,evga geforce gt 520 1024 mb ddr3 pci-express 2.0 graphics card 01g-p3-1521-kr,graphics cards,evga,01g-p3-1521-kr,55.17
Yes,660,10273,1,660,bell o high-speed hdmi cable with ethernet 2-meter,tv accessories,bell ' o,hd7102,69.99,10273,bell o hd7102 high speed hdmi cables,hdmi cables,bell ' o,hd7102,
Yes,925,21757,1,925,oki 43502001 type 9 black toner cartridge,printers,oki,4.3502001 e7,98.0,21757,oki 43502001 type 9 black toner cartridge,printer ink toner,oki data,43502001,68.11
Yes,469,2720,1,469,midland xtc200 hd 720p extreme action camera,camcorders,midland,xtc200,155.88,2720,midland xtc200 hd 720p extreme action camera,sports outdoor gps,midland,,182.6
Yes,1402,20183,1,1402,adesso gp-160pb easy cat 2 button glidepoint touchpad - electrostatic - ps 2,mice,adesso,gp-160pb,34.82,20183,easycat 2button ps 2 touchpad blk cirque glidepoint technology,touch pads,adesso,gp-160pb,27.99
Yes,1983,6913,1,1983,incipio smart feather for apple ipad 2 lime,electronics - general,incipio,ipad-228,33.25,6913,incipio smart feather case for apple ipad 2 - lime ipad-228,cases sleeves,incipio,ipad-228,29.18
Yes,101,2593,1,101,case logic slr camera backpack,mp3 accessories,case logic,dcb-309black,79.99,2593,case logic dcb-309 slr camera backpack black,cases bags,case logic,dcb-309,53.58
Yes,2150,21343,1,2150,dp audio 1000-watt amplifier installation kit,car stereos,dp video,dp88,17.0,21343,dp audio video dp88 8-guage amp kit with rca,power ground cable,dp audio video,dp88,17.0
Yes,2253,11265,1,2253,visontek wireless candyboard mini keyboard with touchpad,electronics - general,visiontek,900319,59.82,11265,visiontek candyboard wireless mini keyboard with touchpad 900319,keyboard mouse combos,visiontek,900319,49.99
Yes,2266,1616,1,2266,lyoto machida mouse pad,mice,wincraft,86210010,16.99,1616,lyoto machida mouse pad,mouse pads,wincraft,,16.99
Yes,2191,16173,1,2191,chicago bears ipod touch 4g hard case,electronics - general,tribeca,fva4587,29.99,16173,chicago bears ipod touch 4g hard case,computers accessories,tribeca,,29.99
Yes,917,17317,1,917,oxford 5-1 4 capacity box file storage box letter binder board black orange,stationery & office machinery,oxford,40578,35.94,17317,oxford 40578 - 5-1 4 capacity box file storage box letter binder board black orange,,oxford,,
Yes,983,18364,1,983,hp cb278an hp 57 ink 500 page-yield tri-color,stationery & office machinery,hp,cb278an,50.05,18364,new-hp cb278an - cb278an hp 57 ink 500 page-yield tri-color - hewcb278an,,hp,,
Yes,2381,3482,1,2381,sony 30mm 37mm wide end conversion lens,photography - general,sony,vclhge08b,75.38,3482,sony vclhge08b wide-end conversion lens for 37mm 30mm camcorders,professional video accessories,sony,vclhge08b,60.0
Yes,542,13159,1,542,epson t078320 claria hi-definition magenta ink cartridge for epson stylus photo printers,printers,epson,t078320,16.84,13159,epson 78 magenta ink cartridge t078320,inkjet printer ink,epson,t078320,8.46
Yes,707,11829,1,707,lg 42 ultra - slim 42lv5500,electronics : flat panel tv,lg,42lv5500,879.0,11829,lg infinia 42lv5500 42-inch 1080p 120 hz led hdtv with smart tv,tvs,lg,42lv5500,
Yes,2094,15247,1,2094,baltimore ravens ipod touch 4g hard case,electronics - general,tribeca,fva4584,29.99,15247,baltimore ravens ipod touch 4g hard case,computers accessories,tribeca,,29.99
Yes,2481,6885,1,2481,samsung wb700 black 14.2 mp digital camera w 18x optical zoom 3.0 lcd display w 50 bonus prints,digital cameras,samsung,ec-wb700zbpbus,299.99,6885,samsung ec-wb700 digital camera with 14 mp and 18x optical zoom black,point shoot digital cameras,samsung,ec-wb700zbpbus,
Yes,949,7346,1,949,trendnet tew-455apbo wireless super g high power outdoor poe access point,networking,trendnet,tew-455apbo,304.88,7346,trendnet 14dbi high power wireless outdoor poe access point tew-455apbo white,wireless access points,trendnet,tew-455apbo,250.84
Yes,424,8534,1,424,cooler master storm sniper edition black,electronics - general,coolermaster,sgc6000kxn1g,146.25,8534,cooler master sgc-6000-kxn1-gp storm sniper atx mid tower gaming case black,computer cases,cooler master,sgc-6000-kxn1-gp,142.77
Yes,2160,9858,1,2160,nikon d3000 black 10.2 mp dslr camera kit with af-s dx nikkor 18-55mm f 3.5-5 .6 g vr lens w 50 bonus prints,digital cameras,nikon,d3000 kit,443.99,9858,nikon d3000 10.2 mp digital slr camera with 18-55mm f 3.5-5 .6 g af-s dx vr nikkor zoom lens,digital slr cameras,nikon,d3000 18-55mm kit,
Yes,1893,11120,1,1893,evga geforce 8400 gs 1gb ddr3 pci express 2.0 graphics card,electronics - general,evga,01g-p3-1302-lr,44.99,11120,evga geforce 8400 gs 1 gb ddr3 pci-express 2.0 graphics card 01g-p3-1302-lr,graphics cards,evga,01g-p3-1302-lr,38.99
Yes,771,5517,1,771,crystal cover set for ipad 2 crystal clear,mp3 accessories,simplism,tr-ccsipd2-cc / en,29.99,5517,simplism japan crystal cover set for ipad 2 - crystal clear tr-ccsipd2-cc en,cases sleeves,simplism japan,tr-ccsipd2-cc / en,29.99
Yes,1022,12116,1,1022,siig 2.5 sata superspeed usb 3.0 hard drive enclosure,electronics - general,siig,ju-sa0912-s1,20.39,12116,siig superspeed usb 3.0 to sata 2.5 enclosure ju-sa0912-s1,cables interconnects,siig,ju-sa0912-s1,19.53
Yes,1944,828,1,1944,lexmark pinnacle pro901 wireless-n all-in-one printer scanner copier fax,printers,lexmark,lexmark pro901,199.99,828,lexmark pinnacle pro901 all-in-one printer,inkjet all-in-one printers,lexmark,90t9105,143.68
Yes,463,11440,1,463,startech 1 dvi-i analog to 2x vga video splitter cable,electronics - general,startech,dvispl1vv,14.57,11440,startech.com dvispl1vv 1 feet dvi-i analog to 2x vga video splitter cable - m f,connectors adapters,startech,dvispl1vv,14.57
Yes,1187,5479,1,1187,sony dsc-h70 black 16.2 mp digital camera bundle w 10x optical zoom 3.0 lcd display case and 4gb sd card w 50 bonus prints,digital cameras,sony,dsc-h70 / bbdl,229.0,5479,sony cyber-shot dsc-h70 16.1 mp digital still camera with 10x wide-angle optical zoom g lens and 3.0-inch lcd black bundle,point shoot digital cameras,sony,dsch70/bbdl,
Yes,102,11759,1,102,panasonic kx-tga660b dect 6.0 plus digital cordless handset black,phones,panasonic,kx-tga660b,40.88,11759,panasonic kx-tga660b extra handset for 664x series cordless phones black,cordless telephones,panasonic,kx-tga660b,35.63
Yes,2259,14834,1,2259,iogear 1gb mobile usb 2.0 scribe digital pen flash drive,usb drives,iogear,gpen300,74.88,14834,iogear mobile scribe digital pen with flash memory gpen300 black,keyboards mice input devices,iogear,gpen300,59.99
Yes,2209,17162,1,2209,bankers box super stor drawer file ltr steel plastic 12-3 4 x 23 x 10-1 2 blk we 6 ctn,storage,bankers box,,179.99,17162,new-bankers box 00371 - super stor drawer file storage box letter steel plastic black white 6 carton - fel00371,storage presentation materials,bankers box,,
Yes,1140,9097,1,1140,genius luxemate t810 wireless keyboard,electronics - general,genius,31340145100,89.99,9097,genius luxemate t810 31340145100 media keyboard,computers accessories,genius,31340145100,62.67
Yes,1803,6872,1,1803,irispen express 6 usb pen scanner for pcs macs by iris,electronics - general,iris,usoa400,109.82,6872,iris usoa400 irispen express 6 pen scanner,scanners,iris,usoa400,105.99
Yes,1153,13245,1,1153,filemate imagine series m2810 usb standard mouse,computers,,,8.98,13245,wintec filemate imagine series m2810 usb standard mouse - white with light blue 3fmnm2810ubl-r,mice,wintec,3fmnm2810ubl-r,11.99
Yes,1356,11269,1,1356,viewsonic pjd7383 dlp projector,electronics - general,viewsonic,pjd7383,729.0,11269,viewsonic pjd7383 xga 1024x768 ultra short throw dlp projector - 3000 lumens 3000 1 dcr 120hz 3d ready 10w speakers,video projectors,viewsonic,pjd7383,764.99
