label_str,ltable_id,rtable_id,label,id_x,title_x,category_x,brand_x,modelno_x,price_x,id_y,title_y,category_y,brand_y,modelno_y,price_y
Yes,810,11428,1,810,startech.com icusb1284 6 ft usb to parallel printer adapter startech icusb1284,printers,,,15.88,11428,startech.com 6 feet usb to db25 parallel printer adapter cable - m f icusb1284d25 icusb1284d25,connectors adapters,startech,,14.25
Yes,1577,13540,1,1577,foldio p2 leather texture folio case for ipad 2 black,mp3 accessories,scosche,ipd2flbk,44.88,13540,scosche foldio p2 black leather texture folio case for ipad 2 ipd2flbk,laptop netbook computer accessories,scosche,ipd2flbk,
Yes,1803,6872,1,1803,irispen express 6 usb pen scanner for pcs macs by iris electronics - general usoa400 109.82,,iris,,,6872,iris usoa400 irispen express 6 pen scanner 105.99,scanners,iris,usoa400,
Yes,2037,21543,1,2037,corsair xms2 4 gb 2 x 2 gb pc2-6400 800 mhz 240-pin ddr2 dual-channel memory kit - twin2x4096-6400c5 corsair twin2x4096-6400c5 74.82,memory,,,,21543,corsair xms2 4 gb 2 x 2 gb pc2-6400 800 mhz 240-pin ddr2 dual-channel memory kit - twin2x4096-6400c5 twin2x4096-6400c5 39.99,computer components,corsair,,
No,787,14949,0,787,da-lite light oak veneer model b manual screen with high power fabric - 60 x 60 av format electronics - general da-lite,,,99731,310.99,14949,honey maple veneer model b manual screen with high power fabric - av format size 60 x 60 projection screens,,da-lite,,
No,2139,13830,0,2139,agf blackberry torch 9800 9810 endo grt case black black electronics - general ha0435-m005,,agf,,25.88,13830,agf grt shell case for blackberry torch 9800 cases grt g003776r00 19.99,,,,
No,278,19779,0,278,da-lite hc cinema vision tensioned advantage electrol - av format 8 x 8 diagonal,electronics - general,da-lite,89939,2595.0,19779,hc cinema vision tensioned advantage deluxe electrol - av format size 50 x 50 projection screens da-lite,,,,
Yes,1466,11641,1,1466,roocase executive leather portfolio case for samsung galaxy tab p1000 electronics - general,,roocase,212537,37.59,11641,roocase executive leather portfolio magenta case cover with stand for samsung galaxy tab tablet p1000 wi-fi 3g cases sleeves 25.0,,roocase,,
No,2371,8969,0,2371,ifrogz summit case for ipad 2 black mp3 accessories ifrogz ipad2sumblk,,,,59.99,8969,ifrogz summit case for ipad 2 - black with blue snap-on shell ipad2-sum-blu ifrogz 39.98,cases sleeves,,ipad2-sum-blu,
No,1228,13482,0,1228,sony cyber-shot dsc-t110 16mp digital camera violet w 4x optical zoom hd movie capture 3.0 touchscreen lcd w 50 bonus prints digital cameras dsc-t110 / v,,sony,,219.99,13482,sony cyber-shot dsc-t110 16.1 mp digital camera with 4x optical zoom and 3-inch touchscreen in silver 8gb accessory kit sony dsc-t110 209.95,point shoot digital cameras,,,
Yes,652,6708,1,652,startech 6 rj-45 to db9 cisco console management router cable db9concabl6 19.0,electronics - general,startech,,,6708,startech 6 ft. rj45 to db9 cisco console management router cable - m f db9concabl6 db9concabl6 14.63,wire management,startech,,
Yes,1827,2578,1,1827,casio exilim ex-zs10 14.1 mp digital camera black w 5x optical zoom 2.7 lcd display digital cameras casio ex-zs10bk,,,,120.0,2578,casio exilim ex-zs10 black 14 mp stylish and slim digital camera with 5x wide-angle zoom and 720p hd video capture,point shoot digital cameras,casio,ex-zs10 black,
Yes,2018,5207,1,2018,wintec filemate 4gb compactflash memory card usb drives 3fmcf4gb-r 15.98,,wintec,,,5207,wintec filemate 4 gb compactflash card memory cards 3fmcf4gb-r 14.99,,wintec,,
Yes,715,7850,1,715,i-tec t1274b istereo round sound docking station for ipod iphone electronics - general,,i-tec electronics,t1274b,79.88,7850,i-tec istereo charging and docking station with remote control for ipod black speaker systems,,i-tec,t1274,40.78
No,1654,9467,0,1654,startech 6 slim 3.5 mm right angle stereo audio cable m m,electronics - general,startech,mu6mms2ra,7.88,9467,startech.com mu6mmsra slim 3.5 mm to right angle stereo audio cable - m m 6 feet mu6mmsra 4.49,connectors adapters,startech,,
Yes,88,18980,1,88,balt wheasel easel adjustable melamine dry erase board white stationery & office machinery,,balt,33250,239.88,18980,new-best-rite 33250 - wheasel easel adjustable melamine dry erase board 28 3 4 x 59 1 2 white - blt33250,stands,best rite,,229.0
Yes,1774,18402,1,1774,crown cross-over indoor outdoor olefin poly wiper scraper mat 36 x 60 brown crown 59.97,home care,,cs0035br,,18402,new-crown cs0035br - cross-over indoor outdoor wiper scraper mat olefin poly 36 x 60 brown - cwncs0035br 92.0,laminating supplies,crown,,
No,1688,18967,0,1688,universal pressboard classification folder legal box of 10 red stationery & office machinery,,,82007,47.84,18967,new-pendaflex 2257r - pressboard classification folders legal six-section red 10 box - ess2257r 38.11,laminating supplies,pendaflex,,
Yes,2210,16560,1,2210,crown tire-track scraper needlepunch polypropylene vinyl mat 48 x 72 anthracite rugs,,crown,te0046ac,124.97,16560,new-crown te0046ac - tire-track scraper mat needlepunch polypropylene vinyl 48 x 72 anthracite - cwnte0046ac,laminating supplies,crown,,
Yes,1694,20397,1,1694,haier ptheatre 4gb pocket theater mp3 player mp3,,,ptheatre,46.26,20397,new-haier ptheatre 4 gb 2 pocket theater mp3 player with video - herptheatre haier,internal hard drives,,,
Yes,973,21568,1,973,lexmark 16 black print cartridge 10n0016 lexmark 28.0,printers,,10n0016,,21568,lexmark 16 black ink cartridge 10n0016,inkjet printer ink,lexmark,10n0016,29.99
No,1924,19550,0,1924,accell premium series 10 usb 3.0 a b cable accell 13.88,electronics - general,,a111b-010b,,19550,new-3 premium series usb 3.0 a b cable - cl4640 accell,cables interconnects,,,10.49
Yes,2050,21912,1,2050,cp technologies clearlinks 6.6 premium gold hdmi cable,electronics - general,cp tech,cl-hdmi-pg-6 .6 ft,11.4,21912,6.6 ft clearlinks premium gold series high-speed hdmi cable cp technology cl-hdmi-pg-6 .6 ft,,,,14.79
Yes,1694,11026,1,1694,haier ptheatre 4gb pocket theater mp3 player mp3,,,ptheatre,46.26,11026,haier pocket theatre 2-inch mp3 player with video-ptheatre black haier 34.99,mp3 players,,ptheatre,
No,889,8826,0,889,logitech wireless mouse m310 bundle computers,,,,29.88,8826,labtec logitech wireless mouse m310 - silver filament 910-002485 mice labtec 28.24,,,910-002485,
Yes,584,965,1,584,iogear solar bluetooth caller announce hands-free car kit iogear 41.88,electronics - general,,gbhfk331,,965,iogear solar bluetooth caller announce hands free car kit gbhfk331 gray,accessories supplies,iogear,gbhfk331,29.99
Yes,2158,9026,1,2158,hp black notebook sleeve hp,electronics - general,,hp nu561aa,15.0,9026,hp 16 inch notebook sleeve - onyx bags cases nu561aa #aba,,hp,,18.32
No,986,4642,0,986,microsoft wireless desktop 800 for business 26.88,electronics - general,microsoft,5sh-00001,,4642,microsoft wireless desktop 800 keyboard and mouse combo keyboard mouse combos microsoft 2lf-00001 27.83,,,,
Yes,1233,12407,1,1233,acd systems acdsee pro 4-box full version software,,acd systems,acdcd70845wi,239.99,12407,acdsee pro 4 box full version,printer accessories,acd,,
Yes,1508,19514,1,1508,canon cli-226 cyan ink tank,printers,canon,4547b001,13.97,19514,canon cli-226 cyan ink tank 4547b001 inkjet printer ink 4547b001 11.99,,canon,,
Yes,2229,14755,1,2229,kodak easyshare c1550 purple 16mp digital camera bundle w 5x optical zoom 3.0 lcd display w 50 bonus prints digital cameras kodak,,,c1550 prpl bndl,89.0,14755,kodak easyshare c1550 16 mp digital camera with 5xoptical zoom - purple point shoot digital cameras c1550pr 99.63,,kodak,,
Yes,1456,18231,1,1456,swingline light touch desktop 2 - or 3-hole adjustable punch stationery & office machinery swingline,,,74030,21.94,18231,new-swingline 74030 - 20-sheet light touch desktop two - or three-hole punch 9 32 diameter hole - swi74030 swingline,shredders,,,49.56
No,387,1160,0,387,evga 1gb geforce gt 520 ddr3 graphics card evga 01gp31521kr,electronics - general,,,68.99,1160,evga geforce gt 520 graphics card video card 01g-p3-1526-kr evga 50.09,graphics cards,,01g-p3-1526-kr,
Yes,69,14641,1,69,lorex simulated bullet style surveillance camera garden - general lorex,,,sg-610,12.84,14641,new-simulated bullet style surveillance camera - t53962 31.0,home security systems,lorex,,
Yes,597,22043,1,597,avery matte white cd dvd labels for inkjet printers 40 face labels 80 spine labels printers avery personal creations 16.47,,,8692,,22043,avery cd dvd labels matte white 40 disc labels and 80 spine labels 8692 avery 8692,labels stickers,,,14.12
Yes,1119,3471,1,1119,startech 100mbps full low profile ethernet multi mode sc fiber pci network card pci100mmsc startech pci100mmsc,networking,,,97.52,3471,startech.com 100mbps full low profile ethernet multi mode sc fiber pci nic card - 2 km pci100mmsc digital media devices pci100mmsc,,startech,,88.99
No,37,5601,0,37,roocase multi-angle folio leather case stylus for acer iconia tab a500 electronics - general roocase 47.99,,,222043,,5601,roocase multi-angle black leather folio case cover for acer iconia tab a500 a501 10.1-inch android tablet wi-fi roocase,,,,29.89
Yes,2179,18387,1,2179,expo dry erase eraserxl with replaceable pad felt 10w x 2d stationery & office machinery 12.19,,expo,,,18387,new-expo 8474 - dry erase eraserxl with replaceable pad felt 10w x 2d - san8474,radios,expo,,23.0
No,1298,19922,0,1298,lenovo thinkpad x60 tablet digitizer pen tether 3pk lenovo 13.67,electronics - general,,41u4820,,19922,thinkpad x60 tablet digitizer pen keyboards mice input devices,,lenovo,,52.99
No,2272,12417,0,2272,3m 98-0440-4809-2 pf27 .0 w privacy screen filter for lcd monitor electronics - general,,3m,98-0440-4809-2,199.88,12417,3m privacy filter - 3m pf27 .0 w9 widescreen monitor privacy screen 16 9 3m pf27 .0 w9,screen filters,,,157.03
Yes,2213,21798,1,2213,clarion 3.5 mm stereo mini-jack to rca extension cable 40 car stereos 29.99,,clarion,ccaaux,,21798,clarion ccaaux female 3.5 mm stereo mini-jack to male rca extension cable with integrated cover audio video accessories ccaaux,,clarion,,23.99
No,665,2821,0,665,da-lite video spectra 1.5 model b manual screen with csr - 69 x 92 video format da-lite 85322 429.99,electronics - general,,,,2821,da-lite model b with csr - projection screen - 1 1 - video spectra 1.5 da-lite,projection screens,,,284.5
Yes,2536,12333,1,2536,gator cases ata molded utility case 11.7 x 16.7 x 5.9 electronics - general gxdf-1116-5-tsa 139.99,,gator cases,,,12333,ata molded utility case 11.7 x 16.7 x 5.9 media storage organization gator 139.99,,,,
Yes,2496,12024,1,2496,acer 23 wide lcd monitor black v epeat 142.0,monitors,acer,v233hajbd,,12024,acer et.vv3hp.a01 23-inch widescreen lcd monitor black monitors et.vv3hp.a01 149.09,,acer,,
No,95,1033,0,95,hp ce505xd black laserjet print cartridges 2pk hp hp ce505xd 258.84,printers,,,,1033,hp laserjet ce505x black print cartridge ce505x,laser printer toner,hp,,
Yes,1402,20183,1,1402,adesso gp-160pb easy cat 2 button glidepoint touchpad - electrostatic - ps 2 gp-160pb,mice,adesso,,34.82,20183,easycat 2button ps 2 touchpad blk cirque glidepoint technology gp-160pb,touch pads,adesso,,27.99
No,433,12366,0,433,apc professional surgearrest 8 outlet 2 pairs phone line protection 120v apc,electronics - general,,pro8t2,25.0,12366,apc pro8 8-outlet surgearrest professional surge protector apc,power strips,,apc pro8,21.98
Yes,1299,15462,1,1299,sony h series np-fh50 actiforce infolithium battery hybrid,dvd accessories,sony,npfh50,38.0,15462,sony npfh50 h series actiforce hybrid infolithium battery for most sony camcorders and a230 a330 and a380 alpha dslr retail packaging camcorder batteries sony np-fh50,,,,30.0
Yes,1846,15547,1,1846,canon psc-4100 deluxe soft case compatible with sx-30 canon camera canon psc-4100 22.99,photography - general,,,,15547,canon psc-4100 deluxe fitted leather case for the powershot sx30 is sx20 is sx10 is sx1 is digital cameras black cases bags canon 5020b001 29.99,,,,
No,572,4643,0,572,microsoft wireless laser desktop 3000 keyboard and mouse combo,electronics - general,microsoft,nud-00001,29.82,4643,microsoft wireless desktop 3000 keyboard and mouse combo keyboard mouse combos mfc-00001,,microsoft,,33.0
Yes,429,3273,1,429,western digital 2tb my book studio edition ii external hard drive computers wdh2q20000n 199.0,,western digital,,,3273,western digital my book studio ii - 2 tb 2 x 1 tb usb 2.0 firewire 800 400 esata desktop external hard drive external hard drives western digital,,,wdh2q20000n,179.99
Yes,1200,159,1,1200,verbatim 95003 3x dvd-ram double-sided media mp3 accessories,,verbatim,95003,13.88,159,verbatim type 4 double-sided dvd-ram cartridge 9.4 gb 3x verbatim 10.45,dvd-ram discs,,,
Yes,1720,20522,1,1720,smead a-z indexed expanding files 21 pockets kraft letter brown stationery & office machinery 12.47,,,70121,,20522,smead 70121 - a-z indexed expanding files 21 pockets kraft letter brown smead,,,,19.02
No,19,11239,0,19,hp 80 ink printhead printhead cleaner black c4890a 268.79,stationery & office machinery,hp,c4890a,,11239,hp c4893a - c4893a hp 80 ink printhead printhead cleaner 4400 page-yield yellow 268.78,distribution,hp,,
Yes,34,3067,1,34,hp 45 black inkjet cartridge 51645a,printers,hp,51645a,35.78,3067,hp 45 black ink cartridge in retail packaging hp,inkjet printer ink,,hp 45 black inkjet print cartridge,28.89
Yes,144,7970,1,144,case logic 16 value laptop briefcase black computers case logic vnci116black,,,,22.0,7970,case logic vnci-116 value 16-inch laptop backpack black bags cases vnci-116 22.0,,case logic,,
No,1513,1591,0,1513,snapshield p2 polycarbonate case ipad 2 smoke mp3 accessories scosche ipd2pcbk,,,,20.88,1591,scosche snapshield p2 polycarbonate case ipad 2 - blue ipd2pcbl laptop netbook computer accessories ipd2pcbl,,scosche,,
No,1745,16721,0,1745,duracell coppertop aa batteries 6pk 4133300407 0.0,electronics - general,duracell,,,16721,duracell coppertop batteries aa duracell,,,mn1500b20,12.19
Yes,276,15426,1,276,sony vgp-bkb1 bluetooth wireless keyboard sony,electronics - general,,vgpbkb1,97.15,15426,sony vaio bluetooth keyboard 97.68,keyboards,sony,vgp-bkb1,
Yes,645,6760,1,645,lexmark prospect pro205 wireless-n all-in-one printer scanner copier fax lexmark pro205,printers,lexmark,,128.54,6760,lexmark prospect pro205 wireless multifunction inkjet printer inkjet all-in-one printers,,lexmark,90t6005,99.99
Yes,707,11829,1,707,lg 42 ultra - slim 42lv5500 42lv5500 879.0,electronics : flat panel tv,lg,,,11829,lg infinia 42lv5500 42-inch 1080p 120 hz led hdtv with smart tv tvs 42lv5500,,lg,,
Yes,2502,16032,1,2502,svat twr301-gx012 digital wireless dvr security system with receiver sd card recording and long range night vision cameras svat electronics twr301-gx012,garden - general,,,249.82,16032,svat gx301-012 digital wireless dvr security system with sd card recording long range night visi computers accessories 345.0,,svat,,
Yes,1727,14918,1,1727,hp touchpad - touchstone charging dock stand,electronics - general,hp,,35.0,14918,hp touchstone charging dock for touchpad docking stations 44.34,,hp,fb339aa #aba,
Yes,2503,20051,1,2503,siig 1-port serial pc card siig 59.99,electronics - general,,jj-pcm012-s3,,20051,1port rs-232 pcmcia 16650 serial pc card computers accessories,,siig,jj-pcm012-s3,50.15
Yes,424,8534,1,424,cooler master storm sniper edition black 146.25,electronics - general,coolermaster,sgc6000kxn1g,,8534,cooler master sgc-6000-kxn1-gp storm sniper atx mid tower gaming case black sgc-6000-kxn1-gp 142.77,computer cases,cooler master,,
Yes,1708,16226,1,1708,pendaflex straight cut conversion folders letter manila box of 100,stationery & office machinery,,16640,33.94,16226,new-pendaflex 16640 - conversion folders straight cut top tab letter manila 100 box - ess16640 laminating supplies 68.0,,pendaflex,,
No,219,729,0,219,microsoft wireless mobile mouse 4000 sgkomen pink microsoft,mice,,d5d-00052,20.0,729,microsoft wireless mobile mouse 4000 - berry pink mice d5d-00019,,microsoft,,15.25
Yes,1988,2476,1,1988,stanley bostitch 00540 antijam extra heavy-duty stapler 215-sheet capacity black stanley bostitch 65.0,stationery & office machinery,,540,,2476,00540 antijam extra heavy duty stapler for up to 215 sheets black bos00540 printer staples,,stanley,,70.99
Yes,829,8897,1,829,joby gorillapod original yellow 19.94,photography - general,joby,gp1ayen,,8897,joby gp1-eyen gorillapod flexible tripod yellow joby gp1-0yen,,,,14.0
Yes,874,5644,1,874,quantum mr-s4mqn-01 dlttape s4 cartridge mr-s4mqn-01,mp3 accessories,quantum,,97.88,5644,quantum data cartridge dlttape s4 warranty mw quantum mr-s4mqn-01,data cartridges,,,95.24
Yes,1424,8192,1,1424,nzxt phantom crafted series atx full tower steel chassis black nzxt 139.82,electronics - general,,nzxt phantom,,8192,nzxt crafted series atx full tower steel chassis - phantom black computer cases nzxt,,,phantom black,119.99
Yes,2133,10434,1,2133,hp c7971a lto ultrium 1 tape cartridge mp3 accessories hp,,,c7971a,39.88,10434,1-pack 100 200gb lto ultrium data cart for surestore ultrium hp c7971a,data cartridges,,,21.99
Yes,547,9295,1,547,verbatim 96438 2gb store n go usb 2.0 flash drive usb drives 96438 14.84,,verbatim,,,9295,verbatim store n go 2 gb usb 2.0 flash drive 96438 metallic pink usb flash drives verbatim 96438,,,,9.99
Yes,378,21690,1,378,maxell 631012 blu-ray disc 15 pk 631012 61.88,mp3 accessories,maxell,,,21690,maxell 631012 blu-ray disc 15 pack blank media maxell 631012 14.03,,,,
No,467,18785,0,467,universal quick set-up lift-off lid box ltr lgl fiberboard 12 x 10 x 15 blk we 12 ctn universal products,storage,,,30.59,18785,universal 952244 - quick set-up lift-off lid storage box letter legal fiberboard white 4 carton,,universal,,
Yes,1908,20111,1,1908,middle atlantic designer inspired ultra quiet fan panel 525.0,tv accessories,middle atlantic,uqfp-4dra,,20111,middle atlantic designer inspired ultra quiet fan panel uqfp-4dra - rack fan kit - black home audio theater 372.42,,middle atlantic,uqfp-4dra,
Yes,1932,9095,1,1932,hp 56 black inkjet cartridge c6656an printers hp,,,c6656an,23.97,9095,genuine hp 56 c6656an black inkjet print cartridge inkjet printer ink c6656an,,hp,,24.19
Yes,996,2750,1,996,maxell timbers wood earbuds oak electronics - general,,maxell,190243 teb-o,29.88,2750,maxell timbers earbud headphones maxell 190243 11.45,,,,
No,1064,21924,0,1064,chief manufacturing projector ceiling mount kit stationery & office machinery 208.8,,chief manufacturing,,,21924,chief mfg cma450 projector ceiling mount plate projector mounts chief,,,cma450,116.72
Yes,388,1450,1,388,fellowes b-121c shredder stationery & office machinery fellowes fel3373001,,,,369.99,1450,b-121c paper shredder,audio video accessories,fellowes,,133.84
Yes,1140,9097,1,1140,genius luxemate t810 wireless keyboard genius 31340145100,electronics - general,,,89.99,9097,genius luxemate t810 31340145100 media keyboard computers accessories genius 31340145100 62.67,,,,
Yes,1790,19800,1,1790,lathem time vis6008 ribbon purple,stationery & office machinery,,vis6008,15.0,19800,new-lathem time vis6008 - vis6008 ribbon purple - lthvis6008 lanthem,impact dot matrix printer ribbons,,,16.2
Yes,155,3446,1,155,sumdex slr camera sling pack 39.99,mp3 accessories,sumdex,144952,,3446,slr camera sling pack sumdex poc-484bk,cases bags,,,44.59
Yes,559,20713,1,559,da-lite deluxe hinged screen joining clamp for fast fold screens electronics - general,,da-lite,89518,31.99,20713,da-lite portable rental screen deluxe hinge joining clamp lamps da-lite 31.99,,,,
Yes,2156,14545,1,2156,cables unlimited - 1 port db25 parallel pci ecp epp spp port i o card electronics - general cables unlimited,,,ioc-1000,16.88,14545,cables unlimited tm 1 - port db25 parallel pci i o card ioc1000 computers accessories,,cables unlimited,ioc1000,20.29
Yes,1320,884,1,1320,kingston m25664f50 2gb ddr2-667 200-pin so dimm sdram laptop memory module memory kingston 38.92,,,m25664f50,,884,kingston 2 gb ddr2 sdram memory module 2 gb 1 x 2 gb 667mhz nonecc ddr2 sdram 200pin m25664f50 memory 28.34,,kingston,m25664f50,
Yes,857,7347,1,857,trendnet tew-690ap wireless n access point networking trendnet 139.82,,,tew-690ap,,7347,trendnet 450 mbps wireless n access point tew-690ap black wireless access points trendnet tew-690ap,,,,119.99
Yes,1298,8455,1,1298,lenovo thinkpad x60 tablet digitizer pen tether 3pk lenovo 13.67,electronics - general,,41u4820,,8455,lenovo thinkpad x60 tablet tether lenovo 10.33,computer accessories,,41u4820,
Yes,2409,11714,1,2409,pioneer cd-iu50v usb interface cable for ipod iphone tm car stereos,,pioneer,cd-iu50v,55.88,11714,pioneer cd-iu50v usb interface cable for ipod iphone,mp3 player cables adapters,pioneer,cd-iu50v,21.99
Yes,805,14294,1,805,apricorn 250gb padlock 256-bit hardware-encrypted portable drive apricorn,computers,,a25-pl256-250,109.84,14294,apricorn aegis padlock 250 gb usb 2.0 256-bit encrypted portable external hard drive a25-pl256-250 grey usb flash drives a25-pl256-250,,apricorn,,99.94
Yes,714,16478,1,714,vivitar high definition .43 x wide angle lens attachment vivitar 22.88,camera and camcorder accessories,,viv-43-58w,,16478,vivitar high defifinition 43x wide angle 58mm camera lenses 17.99,,vivitar,viv-43-58w,
Yes,1334,8618,1,1334,canon cli-226 black ink tank,printers,canon,,0.0,8618,canon cli-226 black ink tank 4546b001 in retail packaging canon 4546b001,inkjet printer ink,,,13.97
Yes,1104,1397,1,1104,tomtom one carry case gps tomtom 9n00 .181,,,,19.96,1397,tomtom one carrying case tomtom 9n00 .181,cases,,,4.99
Yes,1473,3248,1,1473,xantech cpl10 rf ir coupler stereos/audio xantech,,,cpl10,11.88,3248,xantech cpl10 rf ir coupler storage presentation materials xantech 25.5,,,,
Yes,1841,2326,1,1841,belkin f2e9142-wht-apl adc to dvi apple monitor adapter electronics - general belkin 29.88,,,f2e9142-wht-apl,,2326,belkin f2e9142-wht-apl apple monitor adapter 29.44,,belkin,f2e9142-wht-apl,
No,2201,14110,0,2201,pny 4gb micro swivel attache flash drive printers pny 9.84,,,,,14110,pny micro swivel attach 4 gb usb 2.0 flash drive p-fdu4gbsv-ef gry grey usb flash drives,,pny,p-fdu4gbsv-ef / gry,15.51
Yes,2149,4784,1,2149,kodak easyshare m552 dark pink 14mp digital camera w 5x optical zoom 2.7 lcd display w 50 bonus prints kodak,digital cameras,,m552pink,94.54,4784,kodak easyshare m552 14 mp digital camera with 5x optical zoom and 2.7-inch lcd - dark pink new model point shoot digital cameras,,kodak,1942390,
Yes,1195,5364,1,1195,targus 17 platinum blacktop standard laptop computer case black gray electronics - general 46.88,,targus,cpt301us,,5364,targus platinum blacktop 17 standard laptop case - notebook carrying case - 17 - gray black bags cases 35.17,,targus,cpt301us,
Yes,752,7075,1,752,golla genie digital camera bag lime green photography - general golla g761,,,,12.98,7075,genie digital camera bag in lime green cases bags 17.99,,golla,,
Yes,2418,7679,1,2418,powermat wireless charging system for iphone 3g and 3gs power mate,electronics - general,,pmm-1p-b2,19.97,7679,powermat one-position mat with iphone 3g 3gs hard case cases,,power mat,pmm-1pb-b2,20.38
Yes,1454,10760,1,1454,lexmark x644a11a black toner print cartridge,stationery & office machinery,lexmark,x644a11a,326.24,10760,lexmark x644e x646e return program print cartridge inkjet printer ink 205.14,,lexmark,x644a11a,
Yes,1943,15780,1,1943,kenwood 6 5-way performance series flush mount speakers 500 watts kenwood kfc-6993ps 84.99,car stereos,,,,15780,kenwood kfc-6993ps 6-inch x 9-inch performance series 5-way speaker system coaxial speakers kenwood,,,kfc-6993ps,45.19
Yes,2193,9730,1,2193,plustek bookreader v100 - b66-bbe21-a plustek 539.88,computers,,b66-bbe21-a,,9730,plustek book reader v100 plustek 476.7,scanners,,b66-bbe21-a,
Yes,1602,19807,1,1602,buddy products dr. pocket steel 3-pocket wall file black stationery & office machinery buddy products,,,52104,51.94,19807,new-buddy products 52104 - dr. pocket steel three pocket wall file letter black - bdy52104 storage presentation materials buddy,,,,47.49
Yes,1713,21093,1,1713,quality park classic style invitation envelope contemporary white 36226,stationery & office machinery,,,52.94,21093,quality park 36226 - classic style invitation envelope contemporary 5 1 2 white 500 box binding machine supplies,,quality park,,
Yes,93,8350,1,93,audiovox sirius catv distribution kit satellite radio scdk1 42.64,,audiovox,,,8350,audiovox sirius scdk1 outdoor antenna catv distribution kit 33.96,accessories,audiovox,scdk1,
Yes,832,19556,1,832,mukii tip-pu301cb 2-port usb 3.0 expresscard electronics - general tip-pu301cb,,mukii,,32.0,19556,mukii 2-port usb 3.0 expresscard 34 adapter computers accessories mukii 21.25,,,,
No,2349,12225,0,2349,brother tn110bk black toner cartridge printers,,brother,tn110bk,49.88,12225,brother tn-620 toner cartridge laser printer toner brother tn620 47.99,,,,
No,1952,1770,0,1952,pc treasures clickit classic mouse black 07667 16.8,mice,pc treasures,,,1770,pc treasures clickit classic mouse - copper 07724 mice pc treasures 07724 16.8,,,,
Yes,1529,1441,1,1529,dell switch by design studio lids fire red 17r 24.0,electronics - general,dell,8cmcy,,1441,switch by design studio fire red 17-inch 24.0,computers accessories,dell,318-1000,
No,1551,6893,0,1551,blue crane nbc121 introduction to the canon 50d volume 1 basic controls dvd camera and camcorder accessories nbc121 19.0,,norazza,,,6893,introduction to the canon 50d vol . 1 basic controls blue crane digital 20.33,,,zbc121,
Yes,2435,20419,1,2435,micro innovations techcool travel cooler electronics - general 5290100 11.88,,micro innovations,,,20419,techcool travel cooler 5290100,,micro innovations,,8.05
Yes,1953,11438,1,1953,startech 3-port 2b 1a 1394 mini pci express firewire card adapter mpex1394b3,electronics - general,startech,,69.0,11438,startech.com 3 port 2b 1a 1394 mini pci express firewire card adapter mpex1394b3 firewire port cards mpex1394b3 61.24,,startech,,
