label_str,ltable_id,rtable_id,label,id_x,title_x,category_x,brand_x,modelno_x,price_x,id_y,title_y,category_y,brand_y,modelno_y,price_y
No,1228,11499,0,1228,sony cyber-shot dsc-t110 16mp digital camera violet w 4x optical zoom hd movie capture 3.0 touchscreen lcd w 50 bonus prints digital cameras dsc-t110 / v,,sony,,219.99,11499,sony cyber-shot dsc-t110 16.1 mp digital still camera with carl zeiss vario-tessar 4x optical zoom lens and 3.0-inch touchscreen silver sony 189.95,point shoot digital cameras,,dsct110,
No,1530,12831,0,1530,wausau paper astrobrights colored paper 24lb 8-1 2 x 11 planetary purple 500 sheets ream 10.27,stationery & office machinery,wausau paper,22621,,12831,astrobright paper 24lb 8-1 2 x11 planetary purple . printer ink toner wausau,,,,16.99
Yes,2295,21434,1,2295,lexmark 18c2249 36xl 37xl high-yield ink 500 page-yield 2 pack black printers 18c2249,,lexmark,,66.99,21434,new-18c2249 36xl 37xl high-yield ink 500 page-yiel case pack 1 - 513676 lexmark 146.97,computer accessories,,,
Yes,1784,11403,1,1784,dell switch by design studio lids big giant plaid 17r electronics - general 9vmv5 39.0,,dell,,,11403,switch by design studio big giant plaid 17-inch 318-1014,computers accessories,dell,,39.0
Yes,148,16350,1,148,xerox 108r00579 transfer roller printers,,xerox,108r00579,199.88,16350,xerox 108r00579 - 108r00579 transfer roller,home security systems,xerox,,
No,162,18349,0,162,pacon rainbow duo-finish colored kraft paper 35 lbs . 36 x 1000 ft stationery & office machinery 63300 62.94,,pacon products,,,18349,new-pacon 63060 - rainbow duo-finish colored kraft paper 35 lbs . 36 x 1000 ft flame - pac63060 pacon 105.0,storage presentation materials,,,
No,702,21933,0,702,da-lite mahogany veneer model b manual screen with high power fabric - 60 x 60 av format electronics - general 310.99,,da-lite,99735,,21933,medium oak veneer model b manual screen with high power fabric - av format size 60 x 60,projection screens,da-lite,,
Yes,1866,14359,1,1866,samsung clp-500rb opc drum clp-500rb 199.88,printers,samsung,,,14359,samsung opc drum for clp-500 series clp-500rb xaa samsung clp-500rb / xaa 156.44,,,,
No,2297,11014,0,2297,da-lite medium oak veneer model b manual screen with matte white fabric - 60 x 60 diagonal video format da-lite 73171,electronics - general,,,167.99,11014,heritage walnut veneer model b manual screen with matte white fabric - diagonal video format size 60 x 60 diagonal projection screens da-lite,,,,
No,1057,16735,0,1057,s j paper file jackets with 1 1 2 expansion letter 11 pt . manila 50 ctn stationery & office machinery,,s j paper,,45.69,16735,new-s j paper s11320 - file jackets with 1 1 2 inch expansion letter 11 point manila 50 box - sjps11320,laminating supplies,s j paper,,
No,1531,17433,0,1531,hon 10700 series right pedestal credenza 72w x 24d x 29-1 2h mahogany hon,furniture,,10707rnn,799.0,17433,new-hon 10707rnn - 10700 series right pedestal credenza 72w x 24d x 29-1 2h mahogany - hon10707rnn hon,laminating supplies,,,486.0
Yes,1315,21112,1,1315,optoma bl-fp230c replacement projector lamp for optoma ep749 projector optoma,monitors,,bl-fp230c,294.84,21112,optoma bl-fp230c replacement lamp for ep749 ep719h optoma 189.73,lamps,,bl-fp230c,
Yes,2371,10923,1,2371,ifrogz summit case for ipad 2 black mp3 accessories ifrogz ipad2sumblk,,,,59.99,10923,ifrogz summit case snap-in shell carrying case for ipad 2 - black ipad2-sum-blk ipad2-sum-blk,cases sleeves,ifrogz,,47.99
Yes,687,20212,1,687,startech.com pex1p 1 port pcie dp parallel adapter card electronics - general startech pex1p 32.88,,,,,20212,startech.com 1-port pci express dual profile parallel adapter card - spp epp ecp pex1p memory card adapters 26.99,,startech,pex1p,
Yes,2165,21076,1,2165,targus rg0315c pulse backpack notebook case,computers,targus,,38.88,21076,targus rg0315c pulse backpack for notebooks up to 15.4-inch screens black targus rg0315c 32.82,bags cases,,,
Yes,725,16800,1,725,c-line top-load poly sheet protectors heavy gauge letter 200ct stationery & office machinery 62097 28.94,,,,,16800,c-line 62097 - top-load polypropylene sheet protectors heavy gauge letter 200 box c-line,storage presentation materials,,,
Yes,537,790,1,537,logitech ultimate ears 700 earphones logitech 985-000172 228.0,electronics - general,,,,790,logitech ultimate ears 700 noise-isolating earphones - dark silver ultimate ears 985-000172,headphones,,,141.99
Yes,2021,17374,1,2021,crown cushion-step rubber mat 36 x 72 marbleized black crown,home care,,cu3672bk,194.97,17374,crown cu3672bk - cushion-step mat rubber 36 x 72 marbleized black distribution,,crown,,
Yes,2344,4984,1,2344,hp scanjet 5590 digital flatbed scanner hp hp sj5590 273.99,printers,,,,4984,hp scanjet 5590 digital flatbed scanner - flatbed scanner - letter - 2400 dpi x 2400 dpi - adf 50 sheets - hi-speed usb 296.0,,hp,5590 digital flatbed scanner,
Yes,1988,9474,1,1988,stanley bostitch 00540 antijam extra heavy-duty stapler 215-sheet capacity black stanley bostitch 65.0,stationery & office machinery,,540,,9474,stanley bostitch 00540 - 00540 antijam extra heavy-duty stapler 215-sheet capacity black networking products stanley 94.96,,,,
Yes,1229,5842,1,1229,michigan wolverines iphone 4 case silicone cover electronics - general tribeca 24.99,,,fva3437,,5842,michigan wolverines iphone 4 case silicone cover computers accessories,,tribeca,,17.99
No,2391,809,0,2391,da-lite high power model b manual screen with csr - 96 x 96 av format 85311 555.99,electronics - general,da-lite,,,809,da-lite model b with csr high power - projection screen projection screens da-lite high power 289.95,,,,
Yes,1997,12451,1,1997,d-link dgs-1005g 5-port gigabit desktop switch,networking,d-link,dgs1005g,27.88,12451,d-link dgs-1005g 5-port gigabit desktop switch,switches,d-link,dgs-1005g,27.88
Yes,1771,235,1,1771,lexmark c9202 toner 14000 page-yield c9202kh 288.86,printers,lexmark,,,235,new-c9202kh toner 14000 page yield black case pack 1 - 516736,computer accessories,lexmark,,663.42
Yes,1643,2779,1,1643,bluelounge cabledrop black electronics - general bluelounge cd-bl 10.0,,,,,2779,blue lounge design cd-bl cabledrop cable management system for all cables up to 5 16-inch - black wire management 9.95,,bluelounge,cd-bl,
Yes,530,18531,1,530,tops american pride writing pad jr. legal rule 5x8 white 12 50-sheet pads pack stationery & office machinery 75101 18.88,,tops business forms,,,18531,new-tops 75101 - american pride writing pad jr. legal rule 5 x 8 white 12 50-sheet pads pack - top75101,storage presentation materials,tops,,32.47
Yes,317,1082,1,317,siig headrest ipad car mount ce-mt0e12-s1,mp3 accessories,siig,,40.88,1082,headrest ipad car mnt turns into rear seat entertainment sys touch screen tablet accessories ce-mt0e12-s1 23.58,,siig,,
Yes,2106,1253,1,2106,xm xmp3i portable satellite radio and mp3 player with home kit satellite radio audiovox xpmp3h1,,,,149.0,1253,xm xpmp3h1 portable satellite radio and mp3 player xmp3i sirius satellite radio 147.02,handheld portable satellite radios,,xpmp3h1,
Yes,1591,3205,1,1591,dymo labelmanager 260p stationery & office machinery dymo,,,1754490,59.97,3205,dymo labelmanager 260p dymo,label makers,,260p,
Yes,1208,16935,1,1208,xantech 283dmw designer blink emitter single mini wire stereos/audio xantech 283dmw 11.88,,,,,16935,xantech 283dmw designer blink emitter single mini wire amplifier installation,,xantech,,13.0
Yes,30,11088,1,30,fujifilm instax mini twin pack film mini film 2pk,film cameras,fuji,,20.28,11088,fujifilm instax mini twin pack instant film 18.36,film,fuji,instax mini twin pack,
Yes,2069,21448,1,2069,kodak 10c color ink cartridge kodak,printers,,10c,19.97,21448,kodak color ink cartridge 8946501 inkjet printer ink 8946501,,kodak,,17.99
Yes,1695,17274,1,1695,smead recycled end tab fastener folders straight cut 11pt legal manila 50 box stationery & office machinery 37160,,,,41.18,17274,new-smead 37160 - recycled end tab fastener folders straight cut 11 point legal manila 50 box - smd37160 smead,laminating supplies,,,71.0
Yes,15,17364,1,15,avery self-adhesive filing labels 1 3 cut 3-7 16 x 2 3 clear 450 pack avery,stationery & office machinery,,5029,21.47,17364,avery 5029 - self-adhesive filing labels 1 3 cut 2 3 x 3-7 16 clear 450 pack computers accessories,,avery,,
No,1513,5543,0,1513,snapshield p2 polycarbonate case ipad 2 smoke mp3 accessories scosche ipd2pcbk,,,,20.88,5543,scosche snapshield p2 polycarbonate case ipad 2 - purple ipd2pcpu ipd2pcpu 14.09,laptop netbook computer accessories,scosche,,
Yes,1832,13396,1,1832,arkon sgt-7ss sun shade for samsung galaxy tab arkon,car stereos,,sgt-7ss,16.88,13396,sun shade for samsung galaxy tab computers accessories arkon 19.95,,,,
Yes,356,21591,1,356,epson t008201 color ink cartridge for stylus color 780870875 dc 875dcs and 890 printers 20.84,,epson,t008201,,21591,epson t008201 color inkjet cartridge inkjet printer ink,,epson,t008201,18.18
Yes,1037,12168,1,1037,planar 997-2797-00 pl series pl1910m lcd monitor planar 997-2797-00 179.0,monitors,,,,12168,planar pl1910m-bk 19-inch digital analog lcd monitor with speakers black planar 179.0,monitors,,997-2797-00,
Yes,771,5517,1,771,crystal cover set for ipad 2 crystal clear mp3 accessories tr-ccsipd2-cc / en 29.99,,simplism,,,5517,simplism japan crystal cover set for ipad 2 - crystal clear tr-ccsipd2-cc en cases sleeves tr-ccsipd2-cc / en 29.99,,simplism japan,,
No,1171,16356,0,1171,wilson jones wallet file legal recycled kraft stationery & office machinery 5.09,,wilson jones,,,16356,wilson jones wcc7234rg - wallet file legal recycled green wilson jones,,,,
No,1393,16924,0,1393,gbc design view presentation binding system covers clear 8-3 4 2514500,stationery & office machinery,,,19.94,16924,gbc 2020025 - clear view presentation binding system cover 11 x 8-1 2 clear 100 box storage presentation materials gbc,,,,
Yes,211,400,1,211,avery laser inkjet mailing labels mini-sheet 1 x 2-5 8 white 200 pack 7.62,stationery & office machinery,avery,2160,,400,avery mini-sheets laser ink jet labels 1 x 2.625 inches white 200 per pack 2160,shipping labels,avery,02160,5.22
Yes,281,7824,1,281,nextware jellybean case for ipad black mp3 accessories 29.95,,nextware,jelpad-bk,,7824,nextware jellybean case for ipad - black nextware 18.32,cases sleeves,,jelpad-bk,
Yes,1944,828,1,1944,lexmark pinnacle pro901 wireless-n all-in-one printer scanner copier fax printers lexmark,,,lexmark pro901,199.99,828,lexmark pinnacle pro901 all-in-one printer inkjet all-in-one printers lexmark,,,90t9105,143.68
Yes,818,979,1,818,incipio ipod touch 4g silicrylic hard shell case with silicone core all black mp3 accessories 28.5,,incipio,ip-904,,979,incipio silicrylic for ipod touch 4g black black cases incipio ip-904,,,,20.28
Yes,2394,13251,1,2394,western digital 750gb my passport essential se usb 3.0 silver portable hard drive hard drives wdbacx7500asl-nesn,,western digital,,96.98,13251,western digital my passport essential se 750 gb usb 3.0 2.0 ultra portable external hard drive silver external hard drives,,western digital,wdbacx7500asl-nesn,79.0
No,1258,21936,0,1258,da-lite video spectra 1.5 model c manual screen - 78 x 139 hdtv format 787.99,electronics - general,da-lite,82973,,21936,da-lite model c hdtv format manual wall and ceiling screen 78 x 139 159 diagonal silver matte surface projection screens da-lite 539.95,,,,
Yes,1398,4586,1,1398,netgear universal wi-fi range extender netgear wn3000rp100nas 79.88,networking,,,,4586,netgear universal wi-fi range extender wn3000rp 69.66,routers,netgear,wn3000rp,
No,1240,1303,0,1240,visioneer prw120-wu roadwarrior patriot sheetfed scanner electronics - general,,visioneer,prw120-wu,249.98,1303,visioneer roadwarrior mobile 600 dpi usb scanner rw120-wu rw120-wu,scanners,visioneer,,
No,1815,17571,0,1815,wilson jones super heavy weight sheet protector stationery & office machinery wilson jones 21403,,,,10.94,17571,new-wilson jones 21401 - super heavy weight sheet protector non-glare finish clear 50 box - wlj21401 storage presentation materials wilson jones 28.0,,,,
Yes,692,18704,1,692,encore mavis beacon keyboarding kidz software encore 20151 19.98,,,,,18704,mavis beacon keyboarding kidz kids typing audio video accessories encore 20.85,,,20151,
Yes,1528,811,1,1528,innovera m4640 compatible remanufactured high-yield ink 484 page-yield black printers innovera,,,m4640,24.99,811,new-m4640 compatible remanufactured high-yield ink case pack 1 - 513508,computer accessories,innovera,,43.99
Yes,475,12746,1,475,lowrance elite-5 dsi fishfinder base lowrance 740.84,fish finder,,000-10236-001,,12746,lowrance 000-10236-001 elite tm -5 dsi fishfinder base lowrance,gps system accessories,,,744.1
Yes,1090,16634,1,1090,serif webplus essentials,software,serif,wpeusdvdrt,44.82,16634,serif webplus essentials software serif,computers accessories,,,19.99
No,925,21876,0,925,oki 43502001 type 9 black toner cartridge oki 4.3502001 e7 98.0,printers,,,,21876,oki type 9 - toner cartridge - 1 x black - 3000 pages laser printer toner oki 9,,,,38.28
Yes,895,12463,1,895,diaper dude black coated grey digi laptop sleeve 13 electronics - general diaper dude,,,207492,32.0,12463,diaper dude black coated grey laptop sleeve 13-inch digi - lp13cc400 digi - lp13cc400,bags cases,diaper dude,,32.0
No,978,2340,0,978,sharpie permanent markers fine point - black - 12 count,stationery & office machinery,sharpie,30001wm,8.24,2340,new-sharpie 1738519 - grip permanent marker fine point black dozen - san1738519 shredders sharpie 33.09,,,,
No,814,802,0,814,da-lite dual vision tensioned cosmopolitan electrol - av format 7 x 9 diagonal da-lite 84986,electronics - general,,,2346.99,802,da-lite tensioned cosmopolitan electrol - projection screen motorized - 1 1 - dual vision projection screens da-lite cosmopolitan electrol,,,,
Yes,983,18364,1,983,hp cb278an hp 57 ink 500 page-yield tri-color stationery & office machinery hp 50.05,,,cb278an,,18364,new-hp cb278an - cb278an hp 57 ink 500 page-yield tri-color - hewcb278an hp,,,,
No,889,8764,0,889,logitech wireless mouse m310 bundle computers,,,,29.88,8764,logitech wireless mouse m310 dark aces 910-002087 mice,,logitech,910-002087,24.45
Yes,1349,12191,1,1349,night owl security products ccd wired color security camera with 60 cable 67.82,garden - general,night owl,cam-s420-245a,,12191,night owl security products cam-s420-245a ccd wired color security camera with 60 of cable bullet cameras night owl optics,,,cam-s420-245a,59.99
Yes,2017,16793,1,2017,crown ecoplus mat 4 x 6 charcoal home care ecr046ch 144.97,,crown,,,16793,crown ecr046ch - ecoplus mat 4 x 6 charcoal car audio video crown,,,,
Yes,370,15071,1,370,eye-fi connect x2 4gb wireless sd memory card usb drives 39.88,,eye-fi,eyefi4cn,,15071,eye-fi connect x2 4 gb class 6 sdhc wireless flash memory card eye-fi-4cn blank media,,eye-fi,eye-fi-4cn,39.88
Yes,246,13589,1,246,iluv ipod nano 6g clear type protective film mp3 accessories iluv icc1112clr 11.88,,,,,13589,iluv icc1112clr ipod nano 6g clear type protective film apple,printers,,,
Yes,362,16307,1,362,xerox 108r00602 maintenance kit printers 110.84,,xerox,108r00602,,16307,new-108r00602 maintenance kit case pack 1 - 513983,computer accessories,xerox,,327.94
Yes,1007,18142,1,1007,xerox 108r00676 extended-capacity maintenance kit for phaser 8550 printer printers 108r00676 151.54,,xerox,,,18142,new-108r00676 maintenance kit extended capacity case pack 1 - 514003,computer accessories,xerox,,507.23
Yes,1316,4506,1,1316,case logic 208 capacity nylon cd dvd wallet electronics - general 87974,,case logic,,19.99,4506,case logic bnb-208 208 capacity cd dvd prosleeve nylon binder black bnb-208 23.99,media storage organization,case logic,,
Yes,986,6669,1,986,microsoft wireless desktop 800 for business 26.88,electronics - general,microsoft,5sh-00001,,6669,microsoft wireless desktop 800 for business 5sh-00001 keyboards microsoft 5sh-00001,,,,29.95
No,2115,809,0,2115,da-lite high power model b manual screen with csr - 84 x 84 av format electronics - general da-lite 85303 372.99,,,,,809,da-lite model b with csr high power - projection screen projection screens da-lite high power 289.95,,,,
No,664,11618,0,664,adobe photoshop and premiere elements 9 windows and mac software 140.7,,adobe,65087226,,11618,pc treasures 19652 sft adobe photoshop elements 9 premiere elements 9 windows mac version,audio video accessories,pc treasures,,22.67
Yes,1987,16252,1,1987,iluv icc790blk universal windshield smartphone mount kit black electronics - general 24.88,,iluv,icc790blk,,16252,new-iluv icc790blk universal windshield smartphone mount kit - ilvicc790b coin button cell 30.0,,iluv,,
Yes,1394,19580,1,1394,joby gorillapod original orange joby,photography - general,,gp1aten,19.94,19580,joby gp1-dten gorillapod flexible tripod orange joby 14.88,complete tripod units,,gp1 orange,
Yes,2237,1696,1,2237,verbatim 4.7 gb 16x dvd-r whilte inkjet printable 50 packs spindle disc mp3 accessories verbatim 95079,,,,16.14,1696,verbatim 95079 4.7 gb up to 16x datalifepluswhite inkjet printablehub printable recordable disc dvd-r 50-disc spindle verbatim 95079,cd-r discs,,,16.14
No,1317,15355,0,1317,tenba mixx shoulder bag large 136902 85.99,mp3 accessories,tenba,,,15355,tenba 638-625 mixx large camera shoulder bag black orange cases bags,,tenba,638-625,
Yes,2121,4432,1,2121,cooler master atx centurion 534 tower black electronics - general centurion534bk,,coolermaster,,56.25,4432,cooler master centurion 534 plus atx mid tower case black - rc-534-kkn2-gp cooler master rc-534-kkn2-gp,computer cases,,,54.99
Yes,1714,18512,1,1714,s j paper mla end tab classification folder stationery & office machinery s59720,,,,64.94,18512,s j paper s59720 - mla end tab classification folder straight tab letter six-section 25 box printer accessories,,s j paper,,
Yes,2088,17263,1,2088,targus red tg-6660tr tripod with 3-way panhead,photography - general,targus,tg-6660tr,29.98,17263,new-targus red tg-6660tr tripod with 3-way panhead 66 - meytg6660tr tripods targus,,,,31.0
No,2149,10785,0,2149,kodak easyshare m552 dark pink 14mp digital camera w 5x optical zoom 2.7 lcd display w 50 bonus prints kodak,digital cameras,,m552pink,94.54,10785,kodak easyshare m552 14mp digital camera with 5x optical zoom and 2.7-inch lcd in dark pink 4gb accessory kit kodak m552,point shoot digital cameras,,,119.95
Yes,2125,16072,1,2125,scosche it4scbk tch 3 switchback scosche it4scbk,mp3 accessories,,,32.88,16072,scosche switchkase hybrid case for ipod touch 4g black 15.25,cases,scosche,it4scbk,
No,2371,1004,0,2371,ifrogz summit case for ipad 2 black mp3 accessories ifrogz ipad2sumblk,,,,59.99,1004,ifrogz summit case for ipad 2 - black with green snap-on shell ipad2-sum-grn cases sleeves,,ifrogz,ipad2-sum-grn,54.54
Yes,1153,9237,1,1153,filemate imagine series m2810 usb standard mouse 8.98,computers,,,,9237,wintec filemate imagine series m2810 usb standard mouse - white with jet black 3fmnm2810ubk-r mice,,wintec,3fmnm2810ubk-r,11.99
Yes,2353,13476,1,2353,sony dpw30r2h 1.4 gb camcorder 8cm dvd rw mp3 accessories dpw30r2h 8.88,,sony,,,13476,sony dpw30r2h 1.4 gb camcorder 8cm dvd rw single dvd rw discs,,sony,dpw30r2h,3.49
Yes,598,3626,1,598,roocase executive portfolio leather case for asus eee pad transformer tf101 10.1-inch,electronics - general,roocase,222056,43.99,3626,roocase executive portfolio red leather case cover with landscape portrait view for asus eee pad transformer 10.1-inch tf101 android tablet wi-fi cases sleeves roocase 43.64,,,,
Yes,2387,20821,1,2387,powermat wireless charging system for blackberry torch phone accessories powermat pbl01-001-us 38.88,,,,,20821,powermat pbl01-001-us wireless charging system for blackberry torch - charger - retail packaging - black chargers 38.45,,powermat,pbl01-001-us,
Yes,2274,356,1,2274,brother tc20 laminated tape cartridge stationery & office machinery tc20 29.88,,brother,,,356,brother 2-pack tc-20 1 2in black on white labeling tape for pt-6 8 10 12 1520150170,labeling tapes,brother,tc20,22.99
Yes,652,7445,1,652,startech 6 rj-45 to db9 cisco console management router cable db9concabl6 19.0,electronics - general,startech,,,7445,startech.com cisco console management router cable - serial cable - rj-45 m - db-9 f - 6 ft - blue 6ft rj45 to db9 cisco cons rtr cbl manufacturer part number db9concabl6 printer ink toner startech.com usa llp 25.0,,,,
Yes,1360,994,1,1360,iluv portfolio case stand for ipad 2 black,mp3 accessories,iluv,icc816blk,35.88,994,iluv icc816 portfolio case with stand for 2nd generation apple ipad 2 wifi 3g model 16gb 32gb 64gb newest model black icc816blk 20.09,cases sleeves,iluv,,
No,1571,2689,0,1571,da-lite honey maple veneer model b manual screen with matte white fabric - 60 x 60 diagonal video format da-lite 87184,electronics - general,,,167.99,2689,natural walnut veneer model b manual screen with matte white fabric - diagonal video format size 60 x 60 diagonal da-lite,projection screens,,,
Yes,2248,8368,1,2248,arrowmounts cantilever retractable wall mount for flat panel tvs up to 27 tv accessories arrowmounts 39.99,,,am-p16b,,8368,arrowmounts am-p16b cantilever retractable wall mount for flat panel televisions up to 27-inch black arrowmounts,tv mounts,,am-p16b,37.26
Yes,680,843,1,680,cp technologies levelone oan-0501 omni-directional antenna networking 15.71,,cp tech,oan-0501,,843,levelone indoor antenna 5dbi omni-directional,networking products,cp technology,oan-0501,16.99
No,912,16460,0,912,panasonic kx-tg4022n dect 6.0 plus expandable cordless answering system w 2 handsets panasonic kx-tg4022n 44.98,electronics - general,,,,16460,panasonic dect 6.0 expandable digital cordless phone with talking caller id answering system - 2 handset pack,,panasonic,,91.41
Yes,261,5192,1,261,xerox 108r00645 imaging unit for phaser 6300 and 6350 printer xerox 108r00645,printers,,,244.84,5192,xerox printers imaging unit phaser 63006350108 r00645 108r00645,printer ink toner,xerox,,253.79
Yes,841,7503,1,841,sony portable handycam ac adaptor camera and camcorder accessories acl100,,sony,,45.0,7503,sony ac-l100 portable handycam ac adaptor for dcr-dvd 301 dcr-vx2100 hdr-fx1 camcorders sony 19.69,camcorder batteries,,ac-l100,
No,467,21605,0,467,universal quick set-up lift-off lid box ltr lgl fiberboard 12 x 10 x 15 blk we 12 ctn universal products,storage,,,30.59,21605,universal 95224 - quick set-up lift-off lid storage box letter legal fiberboard white 12 ctn,,universal,,63.0
Yes,2231,17839,1,2231,jwin caf nites in-ear earphones pink iep222pnk 9.88,electronics - general,iluv,,,17839,jwin caf nites in-ear earphones - compact stereo - pink - iep222pnk video converters jwin 15.19,,,,
Yes,1753,16220,1,1753,pendaflex recycled top tab file guides 25 set pn925 12.77,stationery & office machinery,,,,16220,new-pendaflex pn925 - recycled top tab file guides alpha 1 5 tab pressboard letter 25 set - esspn925 pendaflex,laminating supplies,,,27.0
Yes,625,18443,1,625,da-lite da-glas standard rear projection screen 72 x 96 video format 27639 4448.99,electronics - general,da-lite,,,18443,da-lite 27639 da-glas standard rear projection screen 72 x 96 video format,projection screens,da-lite,,
Yes,862,5782,1,862,nokia travel charger nokia,phone accessories,,279044,20.53,5782,nokia ac-3u travel charger wall chargers 2.14,,nokia,,
Yes,95,10966,1,95,hp ce505xd black laserjet print cartridges 2pk hp hp ce505xd 258.84,printers,,,,10966,hp laserjet 05x black dual pack cartridge in retail packaging ce505xd ce505xd,laser printer toner,hp,,235.11
Yes,1843,4900,1,1843,imation 46157 dc6250 data cartridge imation 46157,mp3 accessories,,,38.88,4900,imation dc6250 250 500mb cartridge 3m 1-pack data cartridges imation 42482 29.0,,,,
Yes,399,713,1,399,motorola h17 bluetooth headset 89334m,electronics - general,motorola,,38.84,713,motorola h17 bluetooth headset black bluetooth headsets motorola sj0979a 24.94,,,,
Yes,134,3740,1,134,panasonic sdr-s70s silver sd camcorder w 70x optical zoom 2.7 lcd display panasonic panasonic sdr-s70-s 236.32,camcorders,,,,3740,panasonic sdr-s70s camcorder silver camcorders sdr-s70s 181.95,,panasonic,,
Yes,2221,11340,1,2221,franklin electronic publishers spelling ace thesaurus with merriam-webster puzzle solver sa-309,computers,franklin,sa309,20.82,11340,franklin electronic publishers sa-309 spelling ace thesaurus with merriam-webster puzzle solver sa-309,audio video accessories,franklin electronics,,17.18
Yes,136,2576,1,136,casio xj-a235u green slim dlp projector electronics - general casio xja235u,,,,1199.99,2576,casio green slim line projector xj-a235u video projectors casio xj-a235u,,,,
Yes,684,17573,1,684,weyerhaeuser company multiuse premium paper 98 brightness 24lb 8-1 2 x 14 white 500 sheets ream 85781 12.47,stationery & office machinery,,,,17573,new-weyerhaeuser company 85781 - multiuse premium paper 98 brightness 24lb 8-1 2 x 14 white 500 sheets ream - dmr85781 storage presentation materials weyerhauser 33.79,,,,
Yes,2164,3694,1,2164,belkin f1dd104l soho 4-port dvi usb kvm switch belkin 188.84,networking,,f1dd104l,,3694,4 port dvi-usb kvm switch with four usb dvi cables kvm switches f1dd104l 163.99,,belkin,,
No,2224,6745,0,2224,da-lite video spectra 1.5 deluxe model b manual screen - 50 x 67 video format 73639 181.99,electronics - general,da-lite,,,6745,da-lite deluxe model b video spectra 1.5 - projection screen model b video spectra 1.5 125.95,projection screens,da-lite,,
Yes,926,4426,1,926,rolodex petite open tray card file stationery & office machinery,,rolodex,67060,6.47,4426,rolodex 67060 - petite open tray card file holds 125 2 1 4 x 4 cards black accessories supplies,,rolodex,,
Yes,2482,19119,1,2482,3m porcelain marker board steel backed 6 x4 aluminum 3m 462.79,stationery & office machinery,,,,19119,premium porcelain dry erase board computers accessories 3m 293.77,,,,
Yes,1984,1120,1,1984,gear head dual laptop cooling fan cf3000u electronics - general cf3000u 15.0,,gear head,,,1120,gear head cf3000u dual-cool usb laptop cooling fan silver computers accessories gear head,,,cf3000u,14.17
