label_str,ltable_id,rtable_id,label,id_x,title_x,category_x,brand_x,modelno_x,price_x,id_y,title_y,category_y,brand_y,modelno_y,price_y
Yes,376,9389,1,376,toshiba ph3100u-1e3s 1tb usb 3.0 desktop hard drive hard drives toshiba ph3100u-1e3s,,,,89.0,9389,toshiba 1 tb usb 3.0 external hard drive ph3100u-1e3s black silver ph3100u-1e3s,external hard drives,toshiba,,80.23
Yes,1365,18372,1,1365,los angeles lakers ipod touch 4g hard case fva4614,electronics - general,tribeca,,29.99,18372,los angeles lakers ipod touch 4g hard case tribeca,computers accessories,,,29.99
No,1153,7242,0,1153,filemate imagine series m2810 usb standard mouse 8.98,computers,,,,7242,wintec filemate imagine series m2810 usb standard mouse - white with light green 3fmnm2810ugn-r wintec 3fmnm2810ugn-r 11.99,mice,,,
Yes,1356,11269,1,1356,viewsonic pjd7383 dlp projector pjd7383 729.0,electronics - general,viewsonic,,,11269,viewsonic pjd7383 xga 1024x768 ultra short throw dlp projector - 3000 lumens 3000 1 dcr 120hz 3d ready 10w speakers video projectors,,viewsonic,pjd7383,764.99
Yes,709,1096,1,709,griffin ipod touch 4g screen care kit 3 pack arkon gb01913 13.3,mp3 accessories,,,,1096,griffin gb01913 screen care kit for ipod touch 4g 3 pack cases griffin technology gb01913 11.17,,,,
Yes,1081,21587,1,1081,garmin gpsmap 78s 010-00864-01 marine gps navigator and world wide chartplotter handheld gps 399.88,,garmin,gpsmap 78s,,21587,garmin gpsmap 78s 010-00864-01 marine gps navigator and world wide chartplotter boating gps units chartplotters,,garmin,010-00864-01,399.88
No,1688,16652,0,1688,universal pressboard classification folder legal box of 10 red stationery & office machinery,,,82007,47.84,16652,pendaflex 2157r - pressboard classification folders legal four-section red 10 box,storage presentation materials,pendaflex,,
Yes,2006,13921,1,2006,cables unlimited usb 2.0 7 port hub with power electronics - general usb-1870,,cables unlimited,,27.0,13921,cables unlimited usb1870 usb 2.0 7-port desktop hub with power hubs 24.99,,cables unlimited,usb-1870,
Yes,56,21964,1,56,edge tech proshot 4gb sdhc class 6 memory card edge tech pe209780 10.88,usb drives,,,,21964,4gb edge proshot sdhc memory card class6 hard drive enclosures edge edgdm-209780-pe,,,,11.87
Yes,1868,4494,1,1868,q-see qsdb8209c 2.4 inches digital wireless monitoring system night vision and audio camera garden - general q-see qsdb8209c,,,,129.82,4494,q-see qsdb8209c 2.4-inch digital wireless portable monitor with wireless night vision and audio camera q-see qsdb8209c 82.52,surveillance cameras,,,
Yes,1657,16332,1,1657,guardian flexstep antifatigue polypropylene rubber mat 24 x 36 black home care 24020300 36.97,,guardian,,,16332,guardian 24020300 - flexstep rubber antifatigue mat polypropylene 24 x 36 black printer accessories guardian,,,,
Yes,2028,12891,1,2028,acer iconia tablet bluetooth keyboard laptop computers acer,,,a500k01,49.0,12891,acer iconia tab bluetooth keyboard keyboards,,acer,bluetooth keyboard,46.99
Yes,81,17194,1,81,innovera heavyweight photo paper matte 8-1 2 x 11 50 sheets pack stationery & office machinery innovera 11.7,,,99650,,17194,innovera 99650 - heavyweight photo paper matte 8-1 2 x 11 50 sheets pack innovera,antitheft,,,29.73
No,1091,10988,0,1091,hon 600 series two-drawer lateral file black hon,stationery & office machinery,,682lp,449.94,10988,hon 692ll - 600 series two-drawer lateral file 42w x19-1 4d putty printers,,hon,,
No,2126,2139,0,2126,pny 4gb sdhc memory card class 4 pny p-sdhc4g4-ef 8.98,usb drives,,,,2139,pny 4gb class 4 navy sd card car audio video pny p-sdhc4g4-ef / navy 11.18,,,,
No,786,12785,0,786,da-lite video spectra 1.5 model c with csr manual screen - 58 x 104 hdtv format da-lite,electronics - general,,82980,736.99,12785,da-lite model c with csr - projection screen - 1 1 - video spectra 1.5 with csr,projection screens,da-lite,,401.95
Yes,1031,13438,1,1031,sony 39 lightweight camera and camcorder tripod vct-r100 vctr100,camera and camcorder accessories,sony,,24.54,13438,sony vct-r100 lightweight compact tripod with 3-way pan tilt head digital camera accessories sony 24.54,,,vctr100,
Yes,669,12490,1,669,creative labs sound blaster tactic3d alpha,electronics - general,creative labs,gh012000003,59.99,12490,creative labs 70gh012000003 sound blaster tactic 3d alpha usb gaming headset 49.93,accessories supplies,creative labs,70gh012000003,
Yes,97,15904,1,97,lacie firewire 800 expresscard 34,electronics - general,lacie,lac130992,45.0,15904,lacie fw 800 expresscard 34 lacie 44.24,computers accessories,,130992,
No,2434,4727,0,2434,da-lite high power model b manual screen - 72 x 72 av format electronics - general 33424,,da-lite,,229.99,4727,da-lite model b high power - projection screen - 72 in 183 mm projection screens high power 174.95,,da-lite,,
Yes,1832,432,1,1832,arkon sgt-7ss sun shade for samsung galaxy tab arkon,car stereos,,sgt-7ss,16.88,432,arkon sun shade for samsung galaxy tab touch screen tablet accessories arkon 16.88,,,sgt-7ss,
Yes,2076,18297,1,2076,ampad spiral steno book gregg rule 6 canary 70 sheets stationery & office machinery ampad 25473 5.15,,,,,18297,new-ampad 25473 - spiral steno book gregg rule 6 x 9 canary 100 sheets - amp25473 ampad 18.0,storage presentation materials,,,
Yes,741,11537,1,741,simplism shoulder case for ipad red mp3 accessories simplism trlcslipaddren,,,,58.76,11537,simplism leather collection shoulder leather case for ipad deep red cases sleeves,,simplism,tr-lcslipad-dr/en,21.85
Yes,2483,11841,1,2483,kenwood 6.5 2-way 160w speaker system kfc-1652 kenwood 29.99,stereos/audio,,kfc-1652,,11841,kenwood kfc-1652s 6.5-inch 160 watt max power dual cone speaker system coaxial speakers kenwood kfc-1652s 23.75,,,,
Yes,2332,18200,1,2332,da-lite da-plex self trimming rear projection screen - 40 1 4 x 53 3 4 video format 27580 1892.99,electronics - general,da-lite,,,18200,da-plex base rear projection screen - 40 1 4 x 53 3 4 video format projection screens da-lite 1525.99,,,,
Yes,803,4121,1,803,scosche ka2064b 2005 kia sportage iso kit,car stereos,scosche,ka2064b,15.88,4121,scosche ka2064b dash kit for 2005 and up kia sportage dash mounting kits ka2064b,,scosche,,10.99
No,1317,9408,0,1317,tenba mixx shoulder bag large 136902 85.99,mp3 accessories,tenba,,,9408,tenba 638-621 mixx large camera shoulder bag black black tenba,cases bags,,638-621,
Yes,107,12090,1,107,targus 17 groove backpack for laptops black 37.88,electronics - general,targus,cvr617,,12090,targus groove backpack case designed for 17 inch laptops cvr617 black cvr617 34.99,laptop netbook computer accessories,targus,,
Yes,699,3856,1,699,avery file folder labels on mini-sheets 3-7 16 x 2 3 300 pack stationery & office machinery 2180,,avery,,9.21,3856,file folder labels on mini-sheets 3-7 16 x 2 3,printer accessories,avery,,
No,509,1798,0,509,panasonic lumix dmc-fh5v 16.1 mp violet digital camera w 4x optical zoom 2.7 lcd display digital cameras panasonic dmc-fh5v 129.0,,panasonic,,,1798,panasonic lumix dmc-fh5 16.1 mp digital camera with 4x optical image stabilized zoom with 2.7-inch lcd purple panasonic dmc-fh5p-v,point shoot digital cameras,,,
Yes,1489,2077,1,1489,quartet contour fabric bulletin board quartet 7693m 73.24,stationery & office machinery,,,,2077,quartet 7693m - contour fabric bulletin board 36 x 24 mauve plastic burgundy frame cables interconnects quartet,,,,
Yes,1210,1324,1,1210,verbatim 10-pack 50gb 6x blu-ray double layer recordable disc 97335 94.88,mp3 accessories,verbatim,,,1324,verbatim 97335 50 gb 6x blu-ray double layer recordable disc bd-r dl 10-disc spindle verbatim,bd-r discs,,97335,71.99
No,126,21663,0,126,audiovox sirius connect home dock for sp st sv 3-5 satellite radio audiovox schdoc1 55.13,,,,,21663,audiovox sirius schdoc1p siriusconnect pro home dock black schdoc1p 47.4,car electronics,directed electronics,,
No,742,14668,0,742,logitech m305 wireless mouse black,mice,logitech,910-001752,29.73,14668,logitech wireless mouse m305 vivid violet 910-002469 logitech 910-002469,mice,,,19.99
Yes,1145,2867,1,1145,kodak easyshare m531 red 14mp digital camera w 3x optical zoom 2.7 lcd display w 50 bonus prints digital cameras m531 red,,kodak,,89.0,2867,kodak easyshare m531 14mp 3x optical 5x digital zoom hd camera red black digital cameras kodak 104.95,,,,
Yes,1652,14384,1,1652,q-see qs408-811-5 8 channel h. 264 dvr surveillance system with 8 indoor outdoor cmos night vision cameras q-see qs408-811-5,garden - general,,,714.28,14384,digital peripheral solutions q-see qs408-811-5 8 channel h. 264 dvr with 8 indoor outdoor cameras and 500gb hard drive complete surveillance systems qs408-811-5,,q-see,,424.38
Yes,1628,6288,1,1628,sirius outdoor home antenna satellite radio sirius 42.64,,,sha1,,6288,audiovox sirius sha1 outdoor home antenna grey terk,radio antennas,,sha1,33.72
Yes,1512,20844,1,1512,uniden d1680 dect 6.0 with caller id and call waiting 33.84,electronics - general,uniden,d1680,,20844,new-uniden d1680 dect 6.0 cordless phone system with answering system call waiting caller id single-handset system - unnd1680 cordless telephones 37.87,,uniden,,
Yes,916,8910,1,916,iogear smartlink usb 2.0 adapter networking gun262wv,,iogear,,16.23,8910,iogear smartlink usb 2.0 adapter gun262wv black connectors adapters,,iogear,gun262wv,18.18
No,219,2725,0,219,microsoft wireless mobile mouse 4000 sgkomen pink microsoft,mice,,d5d-00052,20.0,2725,microsoft wireless mobile mouse 4000 - white mice d5d-00008 19.99,,microsoft,,
Yes,49,8096,1,49,targus impax sleeve for 15 macbook pro red electronics - general targus tss28802us,,,,35.0,8096,targus impax sleeve for 15-inch macbook pro and macbook air - tss28802us red yellow with gray accents targus tss28802us 29.25,cases sleeves,,,
Yes,215,6601,1,215,buffalo technology ministation metro 1 tb usb 2.0 portable external hard drive with integrated flex cable encryption and turbopc hd-pxt1tu2 b black hard drives hdpxt1tu2b 99.82,,buffalo technology,,,6601,buffalo technology ministation metro 1 tb usb 2.0 portable external hard drive with integrated flex cable encryption and turbopc hd-pxt1tu2 b black computers accessories buffalo technology,,,hd-pxt1tu2 / b,99.82
No,771,11539,0,771,crystal cover set for ipad 2 crystal clear mp3 accessories tr-ccsipd2-cc / en 29.99,,simplism,,,11539,simplism japan crystal cover set for ipad 2 - white tr-ccsipd2-wt en,cases sleeves,simplism japan,tr-ccsipd2-wt / en,29.99
Yes,528,21347,1,528,wintec filemate 4gb swivel usb flash drive black usb drives wintec 3fmusb4gwb-r,,,,7.84,21347,wintec filemate 4 gb swivel usb drive - black 8.99,usb flash drives,wintec,3fmusb4gwb-r,
Yes,313,8870,1,313,sabrent 2-port vga high resolution video splitter electronics - general sabrent vd-vs2p 24.88,,,,,8870,kinamax vd-vs2p kinamax 2 port vga video splitter with up to 2048x1536 high resolution and 350mhz computers accessories vd-vs2p 24.99,,kinamax,,
No,2082,11014,0,2082,da-lite cherry veneer model b manual screen with matte white fabric - 60 x 60 diagonal video format da-lite 73179 167.99,electronics - general,,,,11014,heritage walnut veneer model b manual screen with matte white fabric - diagonal video format size 60 x 60 diagonal projection screens da-lite,,,,
Yes,507,11953,1,507,case logic 10 tablet sleeve black electronics - general lapst110black,,case logic,,16.0,11953,case logic lapst-110 10-inch tablet sleeve black case logic lapst-110 15.75,cases sleeves,,,
Yes,78,12347,1,78,case logic 18 laptop case electronics - general 147735 39.99,,case logic,,,12347,case logic vnc-218 18-inch laptop case black laptop netbook computer accessories case logic vnc-218 29.24,,,,
Yes,589,16953,1,589,sennheiser sh 230 monaural headset 84.0,electronics - general,sennheiser,sh230,,16953,new-sh230 monaural headset - sh230,accessories supplies,sennheiser,,89.32
Yes,1233,18428,1,1233,acd systems acdsee pro 4-box full version software,,acd systems,acdcd70845wi,239.99,18428,acdsee pro 4 box full version 217.58,audio video accessories,acd systems,acdpro4bx,
No,891,3545,0,891,sabrent sata to ide ultra ata mini converter board electronics - general sabrent 10.88,,,sbt-scide,,3545,serial ata sata to sabrent ide ultra ata-100 133 port mini converter computers accessories sbt-stdb,,sabrent,,11.08
Yes,2461,13243,1,2461,filemate imagine series k2010 usb standard keyboard computers,,,,15.12,13243,wintec filemate imagine series k2010 usb standard keyboard - jet black 3fmnk2010ubk-r keyboards wintec 3fmnk2010ubk-r,,,,15.99
Yes,222,1354,1,222,uniden 1360bk desktop corded phone with caller id black electronics - general 1360bk,,uniden,,23.98,1354,uniden 1360bk desktop corded telephone black one phone corded telephones uniden 1360bk,,,,19.9
Yes,614,22045,1,614,atrend-bbox a361-12cp b box series speaker car stereos a361-12cp,,atrend,,56.88,22045,atrend-bbox a361-12cp b box series speaker for ford f150 super crew cab 2009 and up 12-inch atrend-bbox,coaxial speakers,,a361-12cp,56.88
Yes,1136,17383,1,1136,elite screens cinegray prime vision series fixed frame screen - 135 diagonal elite screens 1069.0,electronics - general,,pvr135h1,,17383,cinegray prime vision series fixed frame screen - 135 diagonal projection screens elite 1069.0,,,,
Yes,1367,12146,1,1367,razer lycosa gaming keyboard,electronics - general,razer,lycosa,67.84,12146,razer lycosa mirror gaming keyboard - special edition controllers razer rz03-00181400-r3u1,,,,
No,2201,11698,0,2201,pny 4gb micro swivel attache flash drive printers pny 9.84,,,,,11698,pny micro swivel attach 4 gb usb 2.0 flash drive p-fdu4gbsv-ef blu blue usb flash drives p-fdu4gbsv-ef / blu 7.99,,pny,,
Yes,1963,6961,1,1963,human toolz 3-in-1 netbook pad galaxy black champagne electronics - general 3n1mgc 9.88,,human toolz,,,6961,human toolz 3-in-1 netbook pad galaxy black champagne humantoolz 3n1mgc 5.99,mice,,,
No,889,10725,0,889,logitech wireless mouse m310 bundle computers,,,,29.88,10725,logitech wireless mouse m310 victorian wallpaper 910-002480 logitech 910-002480,mice,,,17.5
No,1226,5477,0,1226,sony cyber-shot dsc-t110 16mp digital camera red w 4x optical zoom hd movie capture 3.0 touchscreen lcd w 50 bonus prints digital cameras 219.99,,sony,dsc-t110 / r,,5477,sony cyber-shot dsc-t110 16.1 mp digital still camera with carl zeiss vario-tessar 4x optical zoom lens and 3.0-inch touchscreen black point shoot digital cameras,,sony,dsct110/b,189.99
Yes,178,19149,1,178,jvc flats lightweight folding headphones silver jvc 36.88,electronics - general,,has160s,,19149,new-silver flats lightweight folding headphones - dq3190 jvc,headphones,,,24.56
Yes,2381,3482,1,2381,sony 30mm 37mm wide end conversion lens photography - general sony,,,vclhge08b,75.38,3482,sony vclhge08b wide-end conversion lens for 37mm 30mm camcorders professional video accessories vclhge08b 60.0,,sony,,
No,1624,7991,0,1624,hp q3675a image transfer kit hp 194.84,printers,,q3675a,,7991,color laserjet 4700 image transfer kit printer transfer units hp 4700/4730/cp4005 195.98,,,,
Yes,1413,2788,1,1413,logitech 910-002463 wireless mouse m305 silver filament mice 910-002463 28.88,,logitech,,,2788,logitech wireless mouse m305 silver filament 910-002463 mice logitech,,,910-002463,20.95
Yes,905,19636,1,905,targus akb04us slim internet media usb keyboard targus 29.0,computers,,akb04us,,19636,targus slim internet media usb keyboard akb04us targus akb04us,keyboards,,,16.99
Yes,991,12312,1,991,avery index maker clear label dividers 5-tab white stationery & office machinery avery 11416,,,,3.88,12312,avery index maker clear label dividers with 5 white tabs 25 count 11446 binder index dividers avery 11446,,,,52.99
Yes,2531,19976,1,2531,night owl security products wired color security camera with 60 of cable night owl 49.71,garden - general,,cam-cm01-245,,19976,night owl security products cam-cm01-245 wired color security camera with 60 of cable bullet cameras cam-cm01-245 39.99,,night owl optics,,
Yes,452,16645,1,452,quartet rewritables dry erase mini-markers fine point 6 assorted colors stationery & office machinery 4.54,,quartet,5.1659312 e7,,16645,quartet 51659312 - rewritables dry erase mini-markers fine point six colors 6 set cd players quartet,,,,23.29
Yes,1246,17191,1,1246,i-tec ipad anti-glare screen protector mp3 accessories,,i-tec electronics,t6020,17.88,17191,i-tec t6020 ipad r anti-glare screen protector,printers,i-tec,,
No,1649,1006,0,1649,ifrogz ipod touch 4 luxe lean case pink mp3 accessories it4ll-pnk 24.99,,ifrogz,,,1006,ifrogz it4ll-red luxe lean for ipod touch 4g - red cases ifrogz it4ll-red,,,,12.5
Yes,1573,5415,1,1573,startech 3 slim 3.5 mm right angle stereo audio cable m m startech mu3mms2ra 7.88,electronics - general,,,,5415,startech.com mu3mms2ra slim 3.5 mm right angle stereo audio cable - m m 3 feet startech mu3mms2ra 4.49,connectors adapters,,,
No,1571,10869,0,1571,da-lite honey maple veneer model b manual screen with matte white fabric - 60 x 60 diagonal video format da-lite 87184,electronics - general,,,167.99,10869,medium oak veneer model b manual screen with matte white fabric - diagonal video format size 60 x 60 diagonal da-lite,projection screens,,,
No,736,17761,0,736,hammermill everyday copy and print paper 92 bright 20lb letter white 5000 sheets ctn hammermill,stationery & office machinery,,162008,46.47,17761,new-hammermill 105007 - copy plus copy paper 92 brightness 20lb 8-1 2 x 11 white 5000 sheets carton - ham105007 storage presentation materials hammermill 89.23,,,,
Yes,600,12881,1,600,kensington k72334us slimblade mouse with nano receiver - laser kensington,mice,,k72334us,32.88,12881,kensington slimblade notebook wireless mouse with nano receiver k72334us mice k72334us 29.99,,kensington,,
Yes,1535,18999,1,1535,mercury luggage executive computer backpack handbags 56.99,,mercury luggage,,,18999,executive computer backpack bags cases mercury 41.58,,,,
Yes,2317,15825,1,2317,logitech f540 wireless headset logitech 981-000277,electronics - general,,,163.0,15825,logitech wireless headset f540 with stereo game audio,accessories supplies,logitech,,119.99
No,1688,9336,0,1688,universal pressboard classification folder legal box of 10 red stationery & office machinery,,,82007,47.84,9336,universal 10316 - pressboard end tab classification folders legal six-section red 10 box,,universal,,
Yes,2341,7893,1,2341,green onions supply 10.1 anti-glare screen protector green onions supply rt-spfg101w / m,electronics - general,,,22.88,7893,green onions supply anti-glare screen protector for 10.1 16 9 hd widescreen screen protectors green rt-spfg10101w / m 19.99,,,,
Yes,1148,16756,1,1148,crown needle rib wipe scrape polypropylene mat 36 x 120 gray home care crown 102.97,,,nr0310gy,,16756,new-crown nr0310gy - needle rib wipe scrape mat polypropylene 36 x 120 gray - cwnnr0310gy laminating supplies 143.0,,crown,,
No,517,4079,0,517,targus 15.4 corporate traveler laptop case,electronics - general,targus,146417,79.99,4079,targus checkpoint-friendly corporate traveler case for 15.4 inch laptops cuct02ua15s black bags cases targus cuct02ua15s,,,,66.27
No,2396,16194,0,2396,crown super-soaker polypropylene wiper mat with gripper bottom 45 x 67 charcoal rugs crown,,,ssr046ch,139.97,16194,crown ssr035ch - super-soaker wiper mat w gripper bottm polypropylene 34 x 58 charcoal antitheft,,crown,,
Yes,446,5774,1,446,namo webeditor professional,software,namo,nwep-usnc,78.0,5774,namo webeditor professional photo video design namo nwep-usnc 76.24,,,,
Yes,1899,5458,1,1899,panasonic kx-fatc506 high yield cyan toner cartridge printers panasonic kx-fatc506,,,,89.84,5458,cyan toner cartridge for kx-mc6020 6040 high yield printer ink toner panasonic kx-fatc506,,,,81.57
Yes,522,14014,1,522,veho vcca002wpc waterproof case for muvi muviturin vcca002wpc,camera and camcorder accessories,veho,,29.98,14014,veho vcca002wpc waterproof case for muvi micro camcorder veho vcca002wpc,cases bags,,,27.05
Yes,1074,20740,1,1074,hp gw405at usb mouse - laser - usb - 2 x button mice hp gw405at 29.88,,,,,20740,hp gw405at usb 2-button laser mouse mice gw405at,,hp,,18.09
Yes,1282,1240,1,1282,d-link systems powerline av 4-port switch starter kit dhp-347av,networking,d-link,dhp-347av,112.0,1240,d-link systems powerline av 4-port switch starter kit dhp-347av powerline network adapters,,d-link,dhp-347av,117.2
Yes,1983,6913,1,1983,incipio smart feather for apple ipad 2 lime electronics - general incipio ipad-228,,,,33.25,6913,incipio smart feather case for apple ipad 2 - lime ipad-228 cases sleeves incipio ipad-228 29.18,,,,
Yes,588,20108,1,588,mionix naos 5000 laser gaming mouse electronics - general mionix,,,000mio5000m,89.96,20108,mionix naos 5000 laser gaming mouse gaming mice mionix,,,26426,79.99
No,742,118,0,742,logitech m305 wireless mouse black,mice,logitech,910-001752,29.73,118,logitech wireless mouse m305 dark vine 910-002081 mice 23.65,,logitech,910-002081,
Yes,723,9675,1,723,razer orochi bluetooth laser gaming mouse - rz01-00300100-r3u1 mice razer rz01-00300100-r3u1 69.84,,,,,9675,razer orochi elite mobile gaming mouse gaming mice razer,,,rz01-00300100-r3u1,57.99
Yes,2257,8356,1,2257,master caster big foot no-slip rubber wedge gray 2pk home care master caster 00972 8.79,,,,,8356,master caster 00972 - big foot doorstop no-slip rubber wedge 2-1 4w x 4-3 4d x 1-1 4h gray 2 pack laminating supplies master caster,,,,
Yes,2094,15247,1,2094,baltimore ravens ipod touch 4g hard case tribeca fva4584 29.99,electronics - general,,,,15247,baltimore ravens ipod touch 4g hard case 29.99,computers accessories,tribeca,,
Yes,2021,17451,1,2021,crown cushion-step rubber mat 36 x 72 marbleized black crown,home care,,cu3672bk,194.97,17451,new-crown cu3672bk - cushion-step mat rubber 36 x 72 marbleized black - cwncu3672bk laminating supplies crown 265.0,,,,
Yes,848,3153,1,848,clarion half-din graphic equalizer with built-in crossover clarion eqs746 99.99,car stereos,,,,3153,new clarion eqs746 half-din graphic equalizer with built-in crossover car stereo head units memory card readers 86.2,,clarion,,
Yes,1080,14454,1,1080,coby personal mini stereo speaker system csp14 csp14 14.0,portable audio,coby,,,14454,coby cs-p14 personal mini stereo speakers 8.56,computer speakers,coby,cs-p14,
No,585,13589,0,585,iluv ipod nano 6g clear glare-free screen film mp3 accessories iluv,,,icc1113clr,11.88,13589,iluv icc1112clr ipod nano 6g clear type protective film apple,printers,,,
Yes,1522,1025,1,1522,hp q1413a universal heavyweight coated paper hp 58.78,stationery & office machinery,,q1413a,,1025,hp universal heavyweight coated paper 36 inches x 100 feet roll roll paper hp,,,q1413a,31.24
Yes,734,5991,1,734,acer diamond black 11.6 aspire one 722-bz197 laptop pc with amd dual-core c-50 processor and windows 7 home premium laptop computers acer,,,lu.sft02 .068,288.0,5991,acer aspire one 722-bz197 netbook - black netbooks acer 307.65,,,lu.sft02 .068,
Yes,1641,15009,1,1641,griffin powerblock dual universal black mp3 accessories,,griffin,na23061,27.88,15009,griffin powerblock dual universal charger for mp3 players and usb devices 2amp - 1a per port black chargers griffin technology na23061 8.3,,,,
No,889,2790,0,889,logitech wireless mouse m310 bundle computers,,,,29.88,2790,logitech wireless mouse m310 soft violet mice logitech,,,910-001918,23.13
No,889,14667,0,889,logitech wireless mouse m310 bundle computers,,,,29.88,14667,logitech wireless mouse m310 vivid violet 910-002488 logitech 910-002488,mice,,,16.5
No,1570,14952,0,1570,hon 10500 series curved return hon 479.0,furniture,,105817rnn,,14952,hon 105817rcc - 10500 series curved return right 42w x 18-24d x 29-1 2h harvest hon,,,,402.29
Yes,2523,10365,1,2523,apc line-r 1200va line conditioner with automatic voltage regulator le1200 tv accessories 48.24,,apc,le1200,,10365,apc le1200 line-r 1200va automatic voltage regulator apc,uninterrupted power supply ups,,le1200,47.99
Yes,218,5046,1,218,griffin technology outfit gloss ipod touch 4g black griffin technology gb01967 24.99,mp3 accessories,,,,5046,griffin gb01967 outfit gloss for ipod touch 4g black cases gb01967,,griffin technology,,3.97
Yes,217,5274,1,217,imation 32gb pocket flash drive imation 27860,usb drives,,,77.21,5274,usb 32gb pocket flash drive imation,car audio video,,27860,44.02
No,570,9470,0,570,startech 70 coaxial high resolution monitor vga cable electronics - general mxt101mmhq70,,startech,,49.0,9470,startech 6-feet coax high resolution vga monitor cable - hd15 m m mxt101mmhq cables interconnects 4.99,,startech,mxt101mmhq,
No,80,17375,0,80,vaultz lock mobile file chest storage box letter legal black vaultz,stationery & office machinery,,vz01270,59.94,17375,new-vaultz vz01008 - locking file chest storage box letter legal 17-1 2 x 14 x 12-1 2 black - idevz01008 label makers vaultz,,,,
Yes,1968,21511,1,1968,chief manufacturing fusion large tilt wall mount 37 - 63 screens furniture chief manufacturing,,,,159.2,21511,chief ltmu - fusion series micro-adjustable universal tilt wall mount for 37 - 63 screens w controlzone chief ltmu 163.04,tv mounts,,,
No,2112,12785,0,2112,da-lite video spectra 1.5 model c with csr manual screen - 7 x 9 av format 82976,electronics - general,da-lite,,697.99,12785,da-lite model c with csr - projection screen - 1 1 - video spectra 1.5 with csr,projection screens,da-lite,,401.95
Yes,148,18936,1,148,xerox 108r00579 transfer roller printers,,xerox,108r00579,199.88,18936,xerox 108r00579 transfer roller for xerox phaser 7750 laser printer 108r00579,printer roll holders,xerox,,153.57
Yes,415,20385,1,415,quartet magnetic dry-erase board mahogany frame stationery & office machinery quartet,,,2544m,419.0,20385,new-quartet 2544m - magnetic dry erase board porcelain 48 x 36 white solid mahogany frame - qrt2544m quartet 426.29,radios,,,
Yes,1776,15489,1,1776,sharp el1192bl printing calculator 37.63,stationery & office machinery,sharp,el1192bl,,15489,sharp el-1192bl desktop 2 color printing calculator sharp 36.89,printing,,el-1192bl,
