label_str,ltable_id,rtable_id,label,id_x,title_x,category_x,brand_x,modelno_x,price_x,id_y,title_y,category_y,brand_y,modelno_y,price_y
Yes,469,2720,1,469,midland xtc200 hd 720p extreme action camera midland,camcorders,,xtc200,155.88,2720,midland xtc200 hd 720p extreme action camera sports outdoor gps midland 182.6,,,,
No,2337,19231,0,2337,edge tech diskgo 500gb external superspeed usb 3.0 hard drive,hard drives,edge tech,pe227821,70.98,19231,diskgo 500gb external hard drive edgdg207342pe,,edge,,121.01
No,1425,10754,0,1425,da-lite hc matte white advantage manual with csr - wide format 164 diagonal da-lite,electronics - general,,34723,1223.99,10754,da-lite advantage manual with csr - projection screen - 1 1 - matte white da-lite 542.95,projection screens,,,
Yes,1252,9635,1,1252,samsung 60-2707-05 samsung galaxy tab multimedia dock electronics - general 60-2707-05,,samsung,,37.88,9635,samsung galaxy tab desktop dock ecr-d980begsta 27.9,docking stations,samsung,ecr-d980begsta,
Yes,542,13159,1,542,epson t078320 claria hi-definition magenta ink cartridge for epson stylus photo printers printers 16.84,,epson,t078320,,13159,epson 78 magenta ink cartridge t078320 inkjet printer ink epson t078320,,,,8.46
Yes,496,4496,1,496,case logic universal pocket - camouflage mp3 accessories 122245 9.59,,case logic,,,4496,case logic upc-2 mossy oak universal pocket case logic upc-2,cases bags,,,11.99
Yes,2345,15061,1,2345,fellowes gel wrist rest graphite electronics - general fellowes,,,91737,12.84,15061,fellowes 91737 gel wrist rest - graphite platinum wrist rests fellowes,,,91737,11.29
Yes,1660,11172,1,1660,dymo shipping labels 2.31 stationery & office machinery 30256 20.82,,dymo,,,11172,dymo labelwriter shipping labels white 2-5 16 x 4 300 per pack 15.15,labeling tapes,dymo,30256,
Yes,2150,21343,1,2150,dp audio 1000-watt amplifier installation kit car stereos dp88 17.0,,dp video,,,21343,dp audio video dp88 8-guage amp kit with rca power ground cable 17.0,,dp audio video,dp88,
Yes,1813,1607,1,1813,xantech 283tpd designer twin plug blink emitter stereos/audio xantech 283tpd 14.88,,,,,1607,xantech 283tpd designer twin plug blink emitter 283tpd 13.64,accessories supplies,xantech,,
Yes,2080,16295,1,2080,alera valencia series reversible return bridge shell furniture alera 109.0,,,va354824my,,16295,new-alera va353624my - valencia series reversible return bridge shell 35w x 23-5 8d mahogany - aleva353624my alera,laminating supplies,,,
Yes,2265,18698,1,2265,siig mini displayport to hdmi adapter,electronics - general,siig,cb-dp0b11-s1,19.88,18698,mini displayport to hdmi adapter siig 15.14,video cables,,cb-dp0b11-s1,
No,2082,10869,0,2082,da-lite cherry veneer model b manual screen with matte white fabric - 60 x 60 diagonal video format da-lite 73179 167.99,electronics - general,,,,10869,medium oak veneer model b manual screen with matte white fabric - diagonal video format size 60 x 60 diagonal da-lite,projection screens,,,
No,1527,5049,0,1527,bic great erase grip chisel dry erase marker black 12pk gdem11-blk,stationery & office machinery,bic,,16.08,5049,bic great erase bold whiteboard dry erase black markers with chisel tip 12 pack dec11bk unknown,computers accessories,,,15.64
No,2114,14704,0,2114,da-lite video spectra 1.5 advantage manual with csr - video format 84 diagonal,electronics - general,da-lite,85703,847.99,14704,da-lite advantage manual with csr - projection screen - 133 in - 16 9 - video spectra 1.5 home audio theater 789.95,,da-lite,,
Yes,1151,18330,1,1151,quality park antistatic fiberboard disk mailer white recycled 25 box stationery & office machinery,,,64126,16.97,18330,new-quality park 64126 - antistatic fiberboard disk mailer 6 x 8 5 8 white recycled 25 box - qua64126 storage presentation materials quality park 51.15,,,,
No,497,3071,0,497,hon 310 series full-suspension file,storage,hon,315cpp,549.0,3071,hon 315cps - 310 series five-drawer full-suspension file legal 26-1 2d charcoal hon 458.6,,,,
Yes,94,9051,1,94,verbatim smartdisk optical mini travel mouse red verbatim ver97255,mice,,,17.2,9051,verbatim optical mini travel mouse 97255 red verbatim 97255 10.45,mice,,,
Yes,2412,7233,1,2412,lexmark x651h11a high-yield toner 25000 page-yield black 565.2,printers,lexmark,x651h11a,,7233,x651h11a high-yield toner 25000 page-yield black inkjet printer ink 413.69,,lexmark,,
Yes,2497,19525,1,2497,samsung ml1610d2 toner drum black printers samsung ml1610d2,,,,93.99,19525,new-ml1610d2 toner drum black case pack 1 - 517881 samsung 184.14,computer accessories,,,
Yes,475,20392,1,475,lowrance elite-5 dsi fishfinder base lowrance 740.84,fish finder,,000-10236-001,,20392,new-lowrance 000-10236-001 elite tm -5 dsi fishfinder base - lra10236001 744.1,fishfinders,lowrance,,
Yes,1761,4576,1,1761,buffalo technology linkstation duo 1 tb 2 x 500 gb network attached storage ls-wx1 .0 tl r1 buffalo technology lswx10tlr1,networking,,,192.63,4576,buffalo technology linkstation mini 1 tb 2 x 500 gb compact network attached storage ls-wsx1 .0 tl r1 network attached storage buffalo technology 199.99,,,ls-wsx1 .0 tl/r1,
Yes,151,691,1,151,neatreceipts portable mobile sheetfed scanner computers neatreceipts 00346neat 199.98,,,,,691,neatreceipts mobile scanner and digital filing system,scanners,neat receipts,00346,199.0
Yes,1338,17543,1,1338,smead 5 expansion end tab file pockets w tyvek straight letter manila 10 box stationery & office machinery 37.94,,,75174,,17543,smead 75174 - 5 1 4 inch expansion end tab file pockets with tyvek letter manila 10 box smead,,,,
No,889,8763,0,889,logitech wireless mouse m310 bundle computers,,,,29.88,8763,logitech wireless mouse m310 silver mice logitech,,,910-001675,21.49
Yes,2326,19268,1,2326,rca 6-device voice activated universal remote control tv accessories rca 37.34,,,rcrv06gr,,19268,new-6-device voice activated universal remote control - cl4702 accessories,,rca,,42.21
Yes,1592,16658,1,1592,zax 87303 pro series 3m composite audio video cable zax,tv accessories,,87303,10.88,16658,new-zax 87303 pro series composite audio video cable 3 m - 87303 zax,cables interconnects,,,9.93
No,545,11634,0,545,roocase multi-angle leather case for lg g-slate 8.9-inch 4g tablet electronics - general 222052,,roocase,,35.99,11634,roocase ultra slim magenta leather case cover with stand for lg g-slate 8.9-inch 4g android tablet wi-fi 4g roocase 32.93,cases sleeves,,,
No,1419,20145,0,1419,innovera softskin gel keyboard wrist rest black electronics - general 11.88,,innovera,51451,,20145,innovera softskin gel wrist rest black wrist rests innovera 13.17,,,,
Yes,1077,11884,1,1077,green onions supply anti-glare screen protector for 17-inch wide laptop lcd screen -1 piece transparent electronics - general 32.88,,green onions supply,,,11884,green onions supply rt-spf1017w m anti-glare screen protector for 17-inch wide laptop lcd screen -1 piece transparent 29.54,bags cases,green,rt-spf1017w / m,
Yes,2141,11048,1,2141,griffin ipod touch 4g dflex protection system front only griffin na02046,mp3 accessories,,,19.88,11048,griffin na02046 dflex protection system for ipod touch 4 front only griffin technology na02046 8.99,cases,,,
Yes,1861,18357,1,1861,innovera d2130b black compatible high-yield toner print cartridge 58.9,printers,innovera,d2130b,,18357,new-innovera d2130b - d2130b compatible high-yield toner 2500 page-yield black - ivrd2130b computer accessories,,innovera,,78.0
Yes,917,17317,1,917,oxford 5-1 4 capacity box file storage box letter binder board black orange stationery & office machinery oxford 40578 35.94,,,,,17317,oxford 40578 - 5-1 4 capacity box file storage box letter binder board black orange oxford,,,,
No,950,19173,0,950,asus 22 lcd monitor vw224t asus vw224t 144.0,monitors,,,,19173,asus vw224u 22-inch widescreen lcd monitor - black monitors vw224u,,asus,,149.0
Yes,979,9553,1,979,simplism protector film for ipad mp3 accessories trpfsipadagen 23.41,,simplism,,,9553,simplism protector film for ipad anti-glare laptop netbook computer accessories simplism tr-pfsipad-ag/en 11.47,,,,
No,993,14690,0,993,da-lite matte white model c with csr manual screen - 50 x 67 video format da-lite,electronics - general,,91841,397.99,14690,da-lite model c with csr - projection screen - matte white da-lite with csr 398.5,projection screens,,,
No,209,18713,0,209,link depot 80mm led computer case fan black,networking,link depot,fan-80-bk,3.98,18713,link depot fan led fan 80mm blue computers accessories link depot fan-4led-80bu,,,,
No,2082,4739,0,2082,da-lite cherry veneer model b manual screen with matte white fabric - 60 x 60 diagonal video format da-lite 73179 167.99,electronics - general,,,,4739,light oak veneer model b manual screen with matte white fabric - diagonal video format size 60 x 60 diagonal projection screens da-lite,,,,
Yes,29,6031,1,29,vantec nexstar mx dual 3.5 sata hard drive enclosure electronics - general vantec 49.71,,,nst-400mx-s2,,6031,vantec nexstar mx nst-400mx-s2 dual 3.5-inch sata to usb 2.0 with jbod external hard drive enclosure black hard drive enclosures nst-400mx-s2,,vantec,,44.99
Yes,2379,10267,1,2379,axis gk-013 107-key ps 2 keyboard black computers,,axis,gk-013,9.72,10267,axis gk-013 107 key ps 2 keyboard black keyboards axis communications,,,gk-013,15.52
No,1702,17898,0,1702,pendaflex interior file folders top tab 100 box stationery & office machinery,,,421013bla,20.94,17898,pendaflex 421013 - interior file folders 1 3 cut top tab letter manila 100 box home audio theater pendaflex,,,,
Yes,1208,18170,1,1208,xantech 283dmw designer blink emitter single mini wire stereos/audio xantech 283dmw 11.88,,,,,18170,xantech 283dmw designer blink emitter single mini wire printers,,xantech,,
Yes,1209,9717,1,1209,polaroid i1237 pink 12mp digital camera w 3x optical zoom 2.7 lcd display polaroid 68.0,digital cameras,,cia-1237pc,,9717,polaroid cia-1237pc 12 mp digital camera with 3x optical zoom pink point shoot digital cameras cia-1237pc,,polaroid,,69.99
Yes,351,10048,1,351,acer iconia tab with wi-fi 10.1 touchscreen tablet pc featuring android 3.0 honeycomb operating system aluminum metallic - 32gb laptop computers acer,,,a500-10s32u,498.0,10048,acer iconia tab a500-10s32u 10.1-inch tablet aluminum metallic tablets acer a500-10s32u,,,,449.0
Yes,2360,7249,1,2360,wilson jones visitor register book red hardcover 112 pages stationery & office machinery wilson jones 41.94,,,s490,,7249,wilson jones s490 - visitor register book red hardcover 112 pages 8 1 2 x 11 1 2,,wilson jones,,43.3
Yes,2083,14539,1,2083,cables unlimited sata ii 3gbps to esata cable with straight connectors electronics - general cables unlimited,,,flt-6600-39,9.82,14539,cables unlimted flt-6600-39 39-inch sata ii 3 gbps to esata cable with straight connectors cables interconnects cables unlimited,,,flt-6600-39,3.24
Yes,2192,3144,1,2192,garmin fishfinder 140 with 4.7-inch display and dual-beam transducer fishfinder 140,fish finder,garmin,,90.8,3144,garmin fishfinder 140 with 4.7-inch display and dual-beam transducer 92.96,accessories supplies,garmin,010-00460-00,
Yes,1992,1274,1,1992,wintec filemate 4gb sdhc secure digital flash memory card usb drives wintec,,,3fmsd4gb-r,7.99,1274,wintec filemate 4 gb class 4 secure digital sdhc card memory cards 3fmsd4gb-r,,wintec,,6.77
No,944,2279,0,944,brother tn360 black toner cartridge brother tn360,printers,,,45.54,2279,brother black high yield toner cartridge tn450 tn450 42.49,laser printer toner,brother,,
Yes,1256,20411,1,1256,netgear wireless-n 150 access point wn604 55.88,networking,netgear,wn604-100nas,,20411,wireless-n 150 access point networking products netgear wn604-100nas,,,,63.99
Yes,1405,14894,1,1405,ibm 28p2010 black toner cartridge ibm,printers,,28p2010,425.0,14894,ibm 28p2010 toner cartridge for ibm infoprint 1130453011404540 high-yield black laser printer toner 28p2010,,ibm,,209.99
No,889,19565,0,889,logitech wireless mouse m310 bundle computers,,,,29.88,19565,logitech wireless mouse m310 flame red 910-002486 mice logitech 17.95,,,910-002486,
Yes,101,2593,1,101,case logic slr camera backpack case logic dcb-309black,mp3 accessories,,,79.99,2593,case logic dcb-309 slr camera backpack black,cases bags,case logic,dcb-309,53.58
Yes,1324,912,1,1324,kensington profit wired full size mouse,mice,kensington,k72343us,19.88,912,kensington pro fit usb ps2 full size wired mouse black 19.55,mice,kensington,k72343us,
Yes,539,11542,1,539,siig ce-mt0b12-s1 satellite speaker mounts in pair furniture siig,,,ce-mt0b12-s1,20.88,11542,satellite speaker mounts-1pair car audio video ce-mt0b12-s1,,siig,,20.64
Yes,1345,14257,1,1345,innovera softskin gel wrist rest black electronics - general 51452 11.25,,innovera,,,14257,softskin gel wrist rest black 10.6,wrist rests,innovera,,
No,625,20429,0,625,da-lite da-glas standard rear projection screen 72 x 96 video format 27639 4448.99,electronics - general,da-lite,,,20429,da-lite 27660 da-glas deluxe rear projection screen - 72 x 96 video format projection screens da-lite,,,,
Yes,2107,8358,1,2107,atrend-bbox a201-12cp b box series single-sealed 10 up-fire enclosure car stereos a201-12cp,,atrend,,60.88,8358,atrend-bbox a201-12cp b box series single-sealed 10 up-fire enclosure for dodge ram quad cab 2002,office electronics,atrend,,93.7
No,1573,13416,0,1573,startech 3 slim 3.5 mm right angle stereo audio cable m m startech mu3mms2ra 7.88,electronics - general,,,,13416,startech.com mu3mmsra slim 3.5 mm to right angle stereo audio cable - m m 3 feet mu3mmsra,connectors adapters,startech,,3.48
No,2149,10786,0,2149,kodak easyshare m552 dark pink 14mp digital camera w 5x optical zoom 2.7 lcd display w 50 bonus prints kodak,digital cameras,,m552pink,94.54,10786,kodak easyshare m552 14mp digital camera with 5x optical zoom and 2.7-inch lcd in black 4gb accessory kit m552 119.95,digital slr camera bundles,kodak,,
Yes,1236,7615,1,1236,royal px70mx paper shredder stationery & office machinery,,royal consumer,29160j,69.99,7615,royal px70mx cross cut shredder with cd shred shredders px70mx,,royal,,54.95
Yes,1141,9253,1,1141,western digital elements 500gb portable se portable hard drive black western digital wdbabv5000abk-nesn 71.98,hard drives,,,,9253,western digital wd elements se portable 500 gb usb 2.0 external hard drive,external hard drives,western digital,wdbabv5000abk-nesn,59.99
Yes,1738,20132,1,1738,kodak white paper cd dvd sleeves 500 pack mp3 accessories 70554 16.99,,kodak,,,20132,kodak 70554 paper sleeves 500 pack kodak 70554 16.99,disc storage wallets,,,
No,2126,19124,0,2126,pny 4gb sdhc memory card class 4 pny p-sdhc4g4-ef 8.98,usb drives,,,,19124,pny 4gb class 4 gray sd card p-sdhc4g4-ef / gray 14.79,memory cards,pny,,
Yes,1362,17388,1,1362,cardinal zippered binder pockets 8-1 2 x 11 clear 3 pack stationery & office machinery 5.27,,,,,17388,cardinal 14201 - zippered binder pockets 8-1 2 x 11 clear 3 pockets pack storage presentation materials cardinal,,,,
Yes,660,10273,1,660,bell o high-speed hdmi cable with ethernet 2-meter 69.99,tv accessories,bell ' o,hd7102,,10273,bell o hd7102 high speed hdmi cables bell ' o,hdmi cables,,hd7102,
Yes,1640,9564,1,1640,sharp el-334mb basic calculator el334tb,stationery & office machinery,sharp,,15.99,9564,sharp el-334tb semi-desktop basic calculator sharp,basic,,el-334tb,7.79
No,2531,4659,0,2531,night owl security products wired color security camera with 60 of cable night owl 49.71,garden - general,,cam-cm01-245,,4659,night owl security products cam-s420-245 ccd wired color security camera with 60 of cable surveillance cameras night owl optics cam-s420-245,,,,49.99
Yes,2342,638,1,2342,canon imageclass mf4570dn laser multifunction printer 288.0,stationery & office machinery,canon,4509b020aa,,638,canon imageclass mf4570dn laser multifunction printer 4509b020aa laser all-in-one printers mf4570dn,,canon,,186.95
No,585,19031,0,585,iluv ipod nano 6g clear glare-free screen film mp3 accessories iluv,,,icc1113clr,11.88,19031,iluv icc1112clr ipod nano 6g clear type protective film screen protectors apple 9.0,,,,
Yes,2478,16862,1,2478,mace security easy watch hidden camera in pir motion detector housing garden - general,,mace security,ewc-pir-rj11,119.82,16862,new-easy watch hidden camera in pir motion detection housing - dq2434,home security systems,mace,,172.0
No,887,20428,0,887,da-lite dual vision tensioned advantage deluxe electrol - hdtv format 92 diagonal electronics - general da-lite,,,88285,4242.99,20428,da-lite tensioned advantage electrol dual vision - projection screen motorized - 106 in projection screens da-lite,,,advantage electrol dual vision,
Yes,222,17534,1,222,uniden 1360bk desktop corded phone with caller id black electronics - general 1360bk,,uniden,,23.98,17534,uniden 1360bk desktop caller id corded phone without answering system corded telephones uniden 38.98,,,,
No,2284,17234,0,2284,sharpie retractable fine point permanent markers sharpie 5.99,stationery & office machinery,,32760,,17234,sharpie 32701 - retractable permanent marker fine point black accessory kits 20.92,,sharpie,,
Yes,2407,12311,1,2407,avery postcards for laser printers 4 white uncoated box of 100 . 19.84,stationery & office machinery,avery,5389,,12311,avery postcards for laser printers uncoated 4 x 6 inches white box of 100 05389 05389,postcards,avery,,13.88
No,459,20827,0,459,pentel quicker clicker automatic pencil,stationery & office machinery,pentel,pd347tc,5.0,20827,penpd345a - quicker clicker automatic pencil,,pentel,,8.05
No,2461,7240,0,2461,filemate imagine series k2010 usb standard keyboard computers,,,,15.12,7240,wintec filemate imagine series k2010 usb standard keyboard - luminous red 3fmnk2010urd-r keyboards wintec 15.99,,,3fmnk2010urd-r,
Yes,529,17879,1,529,rubbermaid 6-tier jumbo incline sorter plastic clear stationery & office machinery rubbermaid 96600ros 19.94,,,,,17879,rubbermaid 96600ros - six-tier jumbo incline sorter plastic 9 3 8 x 10 1 2 x 7 3 8 clear,laminating supplies,rubbermaid,,41.69
No,1688,17244,0,1688,universal pressboard classification folder legal box of 10 red stationery & office machinery,,,82007,47.84,17244,smead 19075 - pressboard classification folders wself tab legal six-section red 10 box office electronics smead,,,,
Yes,1703,17701,1,1703,cardinal holdit self-adhesive multi-punched binder insert strips 25 pack 21110,stationery & office machinery,,,6.18,17701,cardinal 21110 - holdit self-adhesive multi-punched binder insert strips 25 strips pack cardinal,printer accessories,,,
No,1136,16963,0,1136,elite screens cinegray prime vision series fixed frame screen - 135 diagonal elite screens 1069.0,electronics - general,,pvr135h1,,16963,powergain prime vision series fixed frame screen - 135 diagonal projection screens elite 1069.0,,,,
Yes,179,8545,1,179,compucessory compucessory foldable noise canceling headphones black electronics - general 52.99,,compucessory,ccs59224,,8545,noise canceling headphone compucessory,headphones,,,24.49
Yes,662,17258,1,662,tops paper pads legal rule letter size 50 sheet pads dozen,stationery & office machinery,tops business forms,7532,15.47,17258,new-tops 7532 - paper pads legal rule letter size canary 50 sheet pads dozen - top7532,storage presentation materials,tops,,32.77
No,974,10336,0,974,antec 650w earthwatts ea-650 green psu electronics - general antec 90.92,,,ea650green,,10336,antec earthwatts ea650 650w power supply power supplies antec 108.54,,,ea650,
Yes,705,12895,1,705,jvc lightweight folding headphones with bass boost black electronics - general jvc,,,has600b,49.95,12895,jvc has600b light weight headphones black headphones has600b,,jvc,,28.58
Yes,1704,16231,1,1704,pendaflex 15-pocket portafile expanding organizer black 16.88,stationery & office machinery,,,,16231,new-pendaflex 01156 - portafile expanding organizer with 19 pockets letter black - ess01156 laminating supplies pendaflex,,,,
Yes,2297,10869,1,2297,da-lite medium oak veneer model b manual screen with matte white fabric - 60 x 60 diagonal video format da-lite 73171,electronics - general,,,167.99,10869,medium oak veneer model b manual screen with matte white fabric - diagonal video format size 60 x 60 diagonal da-lite,projection screens,,,
Yes,2477,4884,1,2477,jvc inner-ear sports clip earbuds violet jvc 19.95,electronics - general,,haebx5v,,4884,inner-ear sports clip earbuds - violet printer accessories jvc,,,,24.56
Yes,2364,17915,1,2364,tops classified colors notebook narrow rule 5-1 2 x 8-1 2 orchid 100 sheets tops business forms,stationery & office machinery,,99712,11.58,17915,new-tops 99712 - classified colors notebook narrow rule 5-1 2 x 8-1 2 orchid 100 sheets - top99712 tops 19.0,storage presentation materials,,,
Yes,1542,10127,1,1542,audiosource bi8 8 in-wall construction bracket mount 25.88,furniture,audiosource,bi8,,10127,audio source bi8 new construction bracket in-wall 8 inches mount bi8 17.29,speaker parts components,audiosource,,
No,1547,4788,0,1547,fellowes standard glare filter for 16-17 monitors 39.84,computers,fellowes,93785,,4788,fellowes 48129 standard 16 17 in glare filter traditional tint screen filters 48129 9.99,,fellowes,,
Yes,2151,7338,1,2151,polaroid ultraclear screen protector bold 9000 polaroid pscucbb9000 14.99,mp3 accessories,,,,7338,ultraclear screen protector for bold9000 portable audio cellular accessories batteries pscucbb9000 11.87,,polaroid,,
No,948,1204,0,948,edge 512mb 1x512mb pc2100 nonecc unbuffered 200 pin ddr sodimm edge pe187378 22.88,memory,,,,1204,edge - memory - 512 mb - so dimm 200-pin - ddr - 266 mhz pc2100 - unbuffered - non-ecc computers accessories edge 13.99,,,,
Yes,346,8304,1,346,belkin pro series 6 usb 2.0 5-pin min-b cable belkin,electronics - general,,f3u138-06,6.07,8304,belkin f3u138-06 pro series usb 5-pin mini-b cable 6-feet belkin f3u138-06,usb cables,,,5.05
Yes,1439,19654,1,1439,samsung clt-r409 imaging drum unit for clp-310 clp-315 and clp-3170 printers samsung clt-r409 144.84,printers,,,,19654,sascltr409 - imaging drum for samsung clp310 inkjet printer ink samsung 130.95,,,,
Yes,1451,4719,1,1451,logitech 920-003198 mk100 classic desktop usb ps 2 compact design electronics - general logitech,,,920-003198,17.88,4719,logitech classic desktop mk100 920-003198 keyboard mouse combos,,logitech,920-003198,19.99
Yes,1862,15434,1,1862,sony zx series stereo headphones white sony mdrzx100/whi,electronics - general,,,24.88,15434,sony mdrzx100 whi outdoor headphones 15.49,headphones,sony,mdrzx100/whi,
No,658,12878,0,658,keyspan usb twin serial adapter electronics - general keyspan 70.73,,,usa-28xg,,12878,keyspan usa-28x external usb to serial adapter connectors adapters keyspan,,,,
No,65,8836,0,65,epson t020201 color ink cartridge epson t020201 27.0,printers,,,,8836,epson stylus color 880 880i color ink cartridge double pack,inkjet printer ink,epson,t020201-d1,38.31
Yes,1975,8180,1,1975,pc treasures pocketpro 11.6 netbook case red laptop computers 07068,,pc treasures,,15.88,8180,pc treasures 11.6-inch pocketpro netbook case - red 07068,bags cases,pc treasures,,10.55
No,2209,18420,0,2209,bankers box super stor drawer file ltr steel plastic 12-3 4 x 23 x 10-1 2 blk we 6 ctn bankers box 179.99,storage,,,,18420,new-bankers box 00372 - super stor drawer file storage box legal steel plastic black white 6 carton - fel00372 bankers box,storage presentation materials,,,
No,737,4752,0,737,lexmark t650a11a black toner print cartridge lexmark t650a11a,printers,,,202.87,4752,lexmark t650 series print cartridge 7000 yield - genuine oem toner lexmark 231.99,laser printer toner,,,
Yes,898,15335,1,898,tp-link tl-sc3171g wireless day night surveillance camera garden - general tp link tl-sc3171g,,,,172.0,15335,tp-link tl-sc3171g wireless day and night surveillance camera tl-sc3171g,webcams,tp-link,,171.81
No,1242,20348,0,1242,gear head 2.4 ghz wireless optical nano mouse black gear head mp2800blk,mice,,,15.82,20348,2.4 ghz wireless optical nano mouse red usb mice mp2275red 12.0,,gear head,,
Yes,2440,6643,1,2440,targus red tg-ra1010 8-in-1 camera essentials kit photography - general tg-ra1010,,targus,,12.98,6643,targus red tg-ra1010 8-in-1 camera essentials kit 12.99,computer accessories,targus,,
Yes,797,6508,1,797,arkon cmp114 camera mount for windshield dvd accessories 10.98,,arkon,cmp114,,6508,arkon cmp114 camera video recorder windsheild dashboard mount arkon,computer accessories,,,11.99
Yes,2139,101,1,2139,agf blackberry torch 9800 9810 endo grt case black black electronics - general ha0435-m005,,agf,,25.88,101,agf ha0435-m005 case for blackberry torch 9800 and 9810 endo grt - 1 pack - retail packaging - black 23.93,cases,agf,ha0435-m005,
Yes,594,20843,1,594,uniden d2998 dect 6.0 loud and clear digital answering system with cordless handset uniden 79.93,electronics - general,,d2998,,20843,new-uniden d2998 dect 6.0 loud clear big button corded cordless phone with caller id digital answering machine - unnd2998 93.99,cordless telephones,uniden,,
Yes,1607,13172,1,1607,maxell couleur series ear buds purple maxell 190238 16.18,mp3 accessories,,,,13172,new-purple couleur series ear buds - de6235 headphones 21.0,,maxell,,
Yes,1905,7800,1,1905,ocz technology 110gb revodrive pci express solid state drive hard drives ocz technologies,,,oczssdpx1rvd110,429.99,7800,ocz technology revodrive 110 gb pci express 4 gb-s slim solid state drive oczssdpx-1rvd0110 computer components oczssdpx-1rvd0110 264.99,,ocz,,
Yes,1070,18620,1,1070,chicago cubs pink iphone 4 hard case electronics - general tribeca,,,fva4424,29.99,18620,chicago cubs pink iphone 4 hard case computers accessories 23.99,,tribeca,,
Yes,1626,13619,1,1626,hp q1421a universal semi-gloss photo paper hp 94.88,stationery & office machinery,,q1421a,,13619,hp universal semi-gloss photo paper 36 inches x 100 feet roll floppy diskettes hp 74.14,,,q1421a,
